29507818	T22	org	control of bone mass in 	CANDIDATE	. DOCEND
18656202	T15	che	lower than commercial polymeric octadecylsilyalted 	CANDIDATE	 (ODS-p). In addition, the results
18618400	T2	che	'Jicky' by Guerlain (1889) containing 	CANDIDATE	 (2) and linalool (3), 'Vera
23995065	T7	che	neuroinflammation, mitochondrial damage from reactive 	CANDIDATE	 species, and the presence of
10997239	T3	dis	of children with and without 	CANDIDATE	 during a dental recall visit.
13905468	T1	che	DOCSTART Conversion of plasma free 	CANDIDATE	 into triglycerides of plasma lipoprotein
10773617	T19	dis	inhibitors to elderly patients with 	CANDIDATE	, particularly if they are on
18516408	T1	org	as an alternative method of 	CANDIDATE	 sclera preservation. PURPOSE: To compare
24246056	T10	org	patients, but inconsistent findings in 	CANDIDATE	 and animal PKD studies suggest
20110767	T3	org	of polycations like chitosan on 	CANDIDATE	 cells has been reported to
29262741	T9	che	present study, chemo-resistant proteins, including 	CANDIDATE	-regulated protein 78 (GRP78)/clusterin (CLU)
19166208	T2	che	[Deposition of hydroxyapatite on the 	CANDIDATE	 nanotube in simulated body fluid].
793929	T5	org	Flexner shigellae]. Genetic characteristics of 	CANDIDATE	 virulent donor strain 3s, isolated
12799183	T16	che	entry to the raft-disrupting agents 	CANDIDATE	 and filipin, and by their
8044650	T2	dis	uncultured amniocytes. Prenatal diagnosis of 	CANDIDATE	 would be easier if fluorescence
2202610	T2	org	of gonadotropin-releasing hormones in the 	CANDIDATE	, Sparus aurata. I. Cleavage of
11243357	T7	dis	newly described cause of postweaning 	CANDIDATE	 in pigs. Polyclonal rabbit antisera
16667719	T15	che	uptake. These results suggest that 	CANDIDATE	 dissolved in the soil water
12503407	T23	che	to ceftazidime, 38% to piperacillin/	CANDIDATE	, 24% to netilmicin and 16%
29795366	T6	che	non-targeted metabolic profiling that serum 	CANDIDATE	 (IPA), a microbial metabolite of
18188457	T14	che	we analyzed the effects of 	CANDIDATE	 and dexamethasone on AE2 gene
27473976	T5	org	experimentally infected with Haemophilus parasuis. 	CANDIDATE	 is an important swine pathogen
15798397	T38	che	phosphorylation was detected with a 	CANDIDATE	-labeled anti-phosphotyrosine antibody, which allowed
21105921	T10	ggp	consequences of loss of FLP/	CANDIDATE	 function on the ability of
3599651	T21	che	the presence of 0.2 mM 	CANDIDATE	 and Na+, partial excretion of
23624119	T14	che	anti-PTSD effects of TSPO ligands. 	CANDIDATE	, a ligand for TSPO, induces
21098697	T18	ggp	Exogenous expression of HtrA1 in 	CANDIDATE	 and Ark2 cells resulted in
9732378	T11	che	less than that observed with 	CANDIDATE	; however, furosemide administration was associated
17941991	T20	ggp	cell specific transcription factors PDX-1, 	CANDIDATE	 and MafA in the Hepa1-6
26669077	T6	ggp	this alternative cell death mechanism. 	CANDIDATE	 plays an important role in
18541324	T1	org	essential oil and extracts of 	CANDIDATE	 Thunb. to control food-borne pathogenic
15048550	T5	che	pressure (CPP) intervention achieved with 	CANDIDATE	 and norepinephrine after severe head
3271432	T1	che	binding of the antitumor drug 	CANDIDATE	 to DNA. A theoretical study
21495010	T1	che	either a continuous injection of 	CANDIDATE	 or a pulse injection of
20844196	T41	ggp	bone marrow chimeric mice lacking 	CANDIDATE	 in dendritic cells showed moderately
10099854	T10	che	h postdose (p < 0.001). (3) 	CANDIDATE	 tablets 100 mg were effective
3006481	T1	org	sequences in centromeric regions of 	CANDIDATE	 chromosomes. The DNA at human
21909919	T6	ggp	system as well as hemostasis. 	CANDIDATE	 is activated by a wide
9785600	T11	che	acid-induced colonic lesions in rats. 	CANDIDATE	 significantly reduced the severity of
18424580	T5	dis	myocardial infarction due to stent 	CANDIDATE	 resulting from possible clopidogrel resistance
15126786	T1	dis	predicting the pathological stage of 	CANDIDATE	. PURPOSE: We compared the performance
24531741	T44	org	the force of contraction of 	CANDIDATE	 ventricular trabeculae. L-NMMA, an inhibitor
3297621	T4	dis	is advocated for use in 	CANDIDATE	, ankylosing spondylitis, osteoarthritis, musculoskeletal disorders,
21310188	T9	che	each experiment. The muscarinic antagonist 	CANDIDATE	 impaired task performance, while the
18540477	T11	che	MAO-B) is responsible for metabolizing 	CANDIDATE	 and plays an important role
23088138	T4	che	hepatic xenobiotic conditions of use--	CANDIDATE	. The results define the term
29588098	T9	che	samples (6.0 and 34 mug/kg). 	CANDIDATE	 residues were found in a
28058386	T25	che	persisted relatively longer in the 	CANDIDATE	 and placebo groups (mean+/-SD: 6+/-3.08;
23836295	T28	ggp	of Huh-7 cells, whereas endogenous 	CANDIDATE	 knockdown reduced the phosphorylated levels
17356901	T1	org	DOCSTART Trends in 	CANDIDATE	, hepatitis C virus, and human
18050250	T19	ggp	receptor antagonist to determine whether 	CANDIDATE	 is a downstream mediator of
16023185	T7	che	the mechanisms for decreased sensitivity. 	CANDIDATE	 can influence transcription through estrogen
16275488	T10	org	(four post-MI and four normal 	CANDIDATE	) were randomly assigned to treatment
22964480	T35	ggp	calpain did however not affect 	CANDIDATE	-ligand cell surface expression on
17612047	T9	ggp	and other epigenetic factors, [2] 	CANDIDATE	 expression is a characteristic feature
19128228	T1	dis	improve endothelial function: effects on 	CANDIDATE	. Endothelial dysfunction (EtD) has emerged
19601670	T9	che	The three major compounds were 	CANDIDATE	 (22.8-38.8%), p-cymene (13.8-27.9%), and thymol
1834573	T13	org	S. mutans and protection of 	CANDIDATE	-infected rats against the development
7925280	T40	ggp	kinase, but not with fyn, 	CANDIDATE	 or lck, confers DNA binding
20922755	T1	org	and one of these, the 	CANDIDATE	 (Oryzias latipes), is frequently utilized
3302741	T7	che	and baseline secretion of norepinephrine, 	CANDIDATE	 and LHRH were similar between
29481571	T61	che	cells. However, HSP90 inhibition by 	CANDIDATE	 inhibited PLX4032-enhanced ERK signaling and
25497682	T1	che	DOCSTART Effect of biosolids-derived 	CANDIDATE	 and triclocarban on the colonization
15198200	T25	org	expressing Cre recombinase in pre-implantation 	CANDIDATE	 embryos. These ELSE/ELT mice exhibiting
15688065	T5	dis	angiogenesis, neurogenesis, heart development and 	CANDIDATE	. Research on ADAMs and their
21830234	T6	dis	automated region of interest technique. 	CANDIDATE	 showed decreased regional cerebral blood
27189532	T1	dis	DOCSTART The impact of 	CANDIDATE	 on blood leukocyte responsiveness to
24600285	T3	dis	and then declined). Likewise, six 	CANDIDATE	 risk groups (OG) were detected,
18710517	T2	org	pneumoniae early response genes to 	CANDIDATE	 lung epithelial cells. BACKGROUND: Streptococcus
8185524	T7	dis	and blindness. Although prevalence of 	CANDIDATE	 and blindness in 1985 was
17461797	T8	ggp	cytoplasm and nucleus in a 	CANDIDATE	/exportin1-dependent manner. Despite its presence
3100080	T4	che	IP administration. The pharmacokinetics of 	CANDIDATE	 (HMM) and its first metabolite
26667900	T1	ggp	DOCSTART Acute anorexigenic action of 	CANDIDATE	 in rainbow trout is mediated
2166319	T2	dis	follow-up of women with suspected 	CANDIDATE	. In primary diagnosis, sensitivity, specificity,
21490139	T28	ggp	with both NOS1alpha and NOS1beta. 	CANDIDATE	 and DNM3 do not interact
28582548	T1	org	and adult stages of female 	CANDIDATE	 butterflies lead to lower fecundity
2039656	T2	che	of simultaneous Tc-99m diethyl-IDA and 	CANDIDATE	 administration on liver excretory function
18954767	T9	org	AND METHODS: Eight healthy female 	CANDIDATE	 were divided into four groups
16390224	T4	org	peripheral T-cell lymphoma associated with 	CANDIDATE	: a case report and review
7836916	T26	org	of a protective response against 	CANDIDATE	 infection. In contrast, both p55
9414476	T5	ggp	factor (RLF). The relaxin-like factor (	CANDIDATE	) is a novel member of
8184235	T4	org	from practice (290). Inflammatory process (	CANDIDATE	) right-sided suboccipital paraspinal, extending to
29069809	T10	ggp	the p16 product of the 	CANDIDATE	 (CDKN2A) gene. Paradoxically, HPV+ tumor
25136332	T4	org	cause early-onset severe obesity in 	CANDIDATE	. Comprehensive functional studies show that
23020656	T10	dis	clearance, what could explain the 	CANDIDATE	 found in MS. On the
19246579	T3	dis	identified all prevalent cases of 	CANDIDATE	 in 2001 and all incident
24523538	T2	org	measured while older and younger 	CANDIDATE	 adults responded to brief occurrences
1715845	T22	ggp	of NEP in neuropeptide-induced responses, 	CANDIDATE	 is not a regulatory enzyme
17920947	T14	ggp	activating receptors, and intracellular proteins (	CANDIDATE	 and perforin) were heterogeneous. Following
18474683	T34	org	Cyp2b10 by OPZ in wild-type 	CANDIDATE	 was completely absent in CAR-/-
24041273	T24	che	inhomogeneous distribution of iron and 	CANDIDATE	 in the starting materials. X-ray
10607770	T19	ggp	elucidate the diagnostic potential of 	CANDIDATE	 and sCD-8 for monitoring acute
10694559	T3	che	it has been shown that 	CANDIDATE	 or progesterone replacement therapy can
8893992	T16	org	samples, taken from cohorts of 	CANDIDATE	-positive and FIV-negative cats over
26140990	T36	che	DOM moieties become recalcitrant to 	CANDIDATE	 attack. Bromate formation was pronounced
15920472	T18	ggp	structural similarity to the mRNA-guanyly-transferase. 	CANDIDATE	 binds both the hypermethylated cap
11930734	T2	dis	To improve the safety of 	CANDIDATE	 (AAA) repair. METHOD: The experience
14694520	T28	ggp	localized preferentially to the epithelium, 	CANDIDATE	 to the stroma, and LIF
23817442	T2	che	catalytic activity. Monodisperse single-crystal hollow 	CANDIDATE	 nanocubes with exposed (001) facets
2881723	T16	che	gold, mercury, silver and zinc. 	CANDIDATE	 has a particular affinity for
20683679	T24	ggp	alone and furthermore demonstrated that 	CANDIDATE	 secretion by MSCs is, at
26252257	T20	dis	evaluate hs-cTn in patients with 	CANDIDATE	 for the diagnosis of AMI
7661876	T33	che	In this set of studies, 	CANDIDATE	 significantly lowered TPC compared to
13032088	T1	che	DOCSTART Metabolism of 	CANDIDATE	 by liver slices. DOCEND
17383243	T9	che	those in CHO-K1 cells, but 	CANDIDATE	 (PE), particularly 1-O-octadec-1'-enyl-2-oleoyl PE, was
24064284	T39	org	nitrite level was observed in 	CANDIDATE	-infected patients with neurosyphilis. DOCEND
29512752	T17	ggp	regulatory mechanism of action of 	CANDIDATE	 on its direct target VEGFA
24343334	T11	che	diuretic NKCC1 chloride importer antagonist 	CANDIDATE	, that decreases (Cl-)i and reinforces
24052222	T21	dis	poorly in distinguishing AIN from 	CANDIDATE	 or other kidney diseases. DOCEND
196666	T3	che	function. I. Stimulatory effects of 	CANDIDATE	 on insulin release. Islets microdissected
15705628	T34	ggp	CDKN1A, CRMP1, EMP1, ESR1, FY, 	CANDIDATE	, TGFBR2, TIMP3) identified by three
14977151	T7	che	concentration of Total Kjeldahl Nitrogen, 	CANDIDATE	, nitrate/nitrite, and soluble and total
17536208	T31	che	lower serum albumin and lower 	CANDIDATE	 levels are associated with decreased
19555568	T13	che	(IT) methotrexate (MTX) and dexamethasone (	CANDIDATE	), 26.0% received IVIG, 2 patients
22978663	T68	ggp	of miR-21 and its target 	CANDIDATE	 in growth factor-induced colon cancer
10218045	T2	dis	leukoplakia in a patient with 	CANDIDATE	. The first case of oral
2432829	T24	che	acyclovir (ACV), 9-(1,3-dihydroxy-2-propoxymethyl) guanine (DHPG), 	CANDIDATE	 (CEDU), (E)-5-(2-bromovinyl)-2'-deoxyuridine (BVDU), and structurally
1659182	T5	dis	of ductal carcinoma in situ (	CANDIDATE	) are encountered. The authors previously
23384725	T10	ggp	Thus, oxidation-induced conformational change of 	CANDIDATE	 plays a key role in
29183523	T19	ggp	hospitalization. While surgeons may use 	CANDIDATE	 levels on admission for their
8837891	T16	org	of penton base genes of 	CANDIDATE	 and marble spleen disease virus
17375583	T5	dis	in 2 teeth, pulpitis or 	CANDIDATE	 occurred in 3 teeth. The
5657453	T6	che	tissue contents of hexose monophosphate, 	CANDIDATE	, UDP-glucose, UDP-galactose, UDP-N-acetylglucosamine, UDP-N-acetylgalactosamine and
7064679	T1	che	DOCSTART Lack of effect of 	CANDIDATE	 on ordered growth of the
9859023	T2	org	susceptibility by interleukin-1 beta in 	CANDIDATE	 endometrial epithelial cells. Interleukin-1 (IL-1)
938609	T4	dis	groups of untreated patients with 	CANDIDATE	, hyperneophroma and breast carcinoma. Significant
16349852	T25	che	the lowest, trilaurin, tricaprin, tricaprylin, 	CANDIDATE	, tributyrin, tricaproin, and tristearin. The
3303194	T1	dis	DOCSTART [	CANDIDATE	 and digestive neoplasms]. DOCEND
15609601	T15	che	in rats obviously. In addition, 	CANDIDATE	 had the effect of raising
25652387	T21	ggp	In conclusion, these studies position 	CANDIDATE	 temporally in the endocrine differentiation
29735851	T4	dis	articles with keywords such as 	CANDIDATE	, cell cycle, tumor suppressor genes,
19248171	T6	org	of the TMJ of male 	CANDIDATE	 leads to condylar growth. These
970105	T3	org	major were carried out in 	CANDIDATE	. At least six different cell
23073221	T9	che	Another conformational study showed that 	CANDIDATE	 side chain interacts with adjacent
14726475	T12	ggp	Overexpression of PGC-1alpha in tet-on 	CANDIDATE	 mice during the neonatal stages
26587782	T2	che	Appendicular Skeleton in Male Mice. 	CANDIDATE	 is a crucial regulator of
25407932	T7	org	by and the virulence of 	CANDIDATE	. One synthetic and four commercial
9005522	T12	org	3), C. parapsilosis (n = 2), 	CANDIDATE	, C. kefyr and C. lusitaniae
21750414	T7	ggp	carriers of RFX6 mutations. Therefore, 	CANDIDATE	 appears to have a pivotal
8579114	T8	ggp	to localize sites of collagenase, 	CANDIDATE	, and matrilysin expression in 26
25648209	T25	org	effect on CPT biosynthesis in 	CANDIDATE	. The MTT assay results indicated
28288949	T3	che	busulfan exposure, therapeutic monitoring of 	CANDIDATE	 is often used in myeloablative
11852361	T8	dis	of this rare variant of 	CANDIDATE	 with osteoblastic heterologous elements have
29349393	T6	ggp	His genetic testing revealed a 	CANDIDATE	 mutation, a condition associated with
25115871	T6	che	observed in patients who received 	CANDIDATE	 than in placebo recipients, although
12161434	T32	che	(2) cSHMT, a high affinity 	CANDIDATE	-binding protein, sequesters this cofactor
20826567	T13	che	in a murine model of 	CANDIDATE	-induced pulmonary fibrosis. Similar to
24451968	T16	org	regimens have been used for 	CANDIDATE	 infection, the H. pylori eradication
25637283	T17	che	phosphatase 2 (PP2A). The drug 	CANDIDATE	 (activator of PP2A) induced apoptosis
8864461	T4	dis	recipients are at risk of 	CANDIDATE	 either due to reactivation or
21205742	T35	che	interaction in the presence of 	CANDIDATE	, which may facilitate ATF3 transcriptional
9240252	T22	ggp	than in estrogen-dominant FF, whereas 	CANDIDATE	 levels in FF from female-to-male
15869672	T1	org	edema in acute animal and 	CANDIDATE	 studies. MATERIALS AND METHODS: We
15367103	T43	che	stimulation of AICAR-stimulated glucose uptake. 	CANDIDATE	 abolished the AICAR-mediated increase in
2697108	T5	dis	bacilli. Animals found to have 	CANDIDATE	 at post mortem had increased
25246139	T35	ggp	P<0.01). The protein expression of 	CANDIDATE	 in the BHS group was
1777649	T1	dis	trends in the epidemiology of 	CANDIDATE	 in European and Mediterranean countries.
10598575	T20	che	the concentration and activity of 	CANDIDATE	-dependent protein kinase [protein kinase
27320966	T8	org	have become a reservoir of 	CANDIDATE	. This study is the first
24991923	T6	dis	nonsignificantly. Knowledge of diabetes and 	CANDIDATE	 increased significantly (P<0.001 for both).
19496415	T3	org	adults of the sheep tick 	CANDIDATE	 pair according to their genetic
26442145	T3	dis	generate minute incisions or target 	CANDIDATE	 cells. This paper will begin
26201484	T2	dis	treatment of various types of 	CANDIDATE	. Nanocarriers are able to reduce
22433250	T5	org	formed upon the engagement of 	CANDIDATE	 envelope gp120 on the infected
17399751	T22	che	route from artemisinic alcohol to 	CANDIDATE	 and to engineer more efficient
18422453	T10	che	(87%) were nalidixic acid resistant; 	CANDIDATE	 resistance was associated with travel
28719243	T1	org	DOCSTART Genotyping-by-Sequencing-Based Genetic Analysis of 	CANDIDATE	 Cultivars and Association Mapping of
25981502	T1	org	Hypoxia in Atherosclerotic Plaques in 	CANDIDATE	. DOCEND
2568266	T22	che	induced by higher doses of 	CANDIDATE	 in the 6-OHDA group (reduced
26509304	T6	dis	included. The presence of overweight/	CANDIDATE	, hypertension, dyslipidemias, hyperglycemia, elevated C-reactive
1961740	T9	org	fluid (conditioned medium) of cultured 	CANDIDATE	 vascular endothelial cells inhibits activation
8069850	T8	ggp	an antisense RNA to the 	CANDIDATE	 (IGF-1R) RNA, which causes a
17062696	T42	ggp	activity in models that overexpress 	CANDIDATE	 (GEO), as well as in
24640674	T5	dis	antiviral drugs in patients with 	CANDIDATE	 (CHC) on the disease burden
22185654	T8	che	Ni(II) cycling through goethite and 	CANDIDATE	 (adsorbed Ni incorporates into the
26969108	T21	che	glycogen could be converted into 	CANDIDATE	 to help the individual resist
23041419	T8	che	(87%), methyl salicylate (67%), and 	CANDIDATE	 (30%). For low risk drinking
1428258	T8	che	magnitude at each region. With 	CANDIDATE	, only 1 dog had inducible
21617813	T11	che	by the anti-cancer natural product 	CANDIDATE	. DOCEND
26542628	T16	che	i.p.). Finally, the effect of 	CANDIDATE	 on Na(+) and Ca(2+) channels
23232072	T3	ggp	DOCSTART 	CANDIDATE	 (IDO1) activity correlates with immune
18640265	T14	che	lutein source for 4 weeks. 	CANDIDATE	 metabolites/oxidation products obtained from in
22135492	T10	dis	17.1% of those diagnosed with 	CANDIDATE	 only (P < 0.001). The kappa
2649597	T2	dis	at the basement membrane in 	CANDIDATE	. Recent studies showing that type
1715869	T8	ggp	activity that is stimulated by 	CANDIDATE	. The protein was designated MAFP
2354199	T9	che	protein molecule adsorbed to a 	CANDIDATE	 surface. They were observed in
23685759	T1	dis	lateral objects in children with 	CANDIDATE	. Autism spectrum disorder (ASD) is
28426698	T23	che	1-methylimidazoleacetate, kyurenate, arachidonic acid and 	CANDIDATE	 were associated with mortality (p
8330355	T67	che	vitro in DNA and in 	CANDIDATE	-containing polynucleotides were also found
3418110	T2	ggp	the strong binding capacity of 	CANDIDATE	 for Congo red can be
7357460	T3	che	neonatal mice were exposed to 	CANDIDATE	, an inhibitor of DNA synthesis.
19795938	T23	che	of low infusion rates of 	CANDIDATE	 and norepinephrine is recommended to
11274970	T23	ggp	in microsomes from BNF-treated mice. 	CANDIDATE	 to CYP1A2 ratios were greater
27552392	T30	che	and placebo-controlled trial showing that 	CANDIDATE	 is effective in reducing this
15235903	T1	org	declines, and a fungal pathogen ( 	CANDIDATE	; Chytridiomycota) is a suspected causal
22670782	T13	che	(p < 0.001) was obtained when 	CANDIDATE	 was administered as ABZ-P 188
15173551	T20	che	in 20-45% of patients. CONCLUSIONS: 	CANDIDATE	 is an appropriate and valuable
8251870	T1	che	Measurement of the severity of 	CANDIDATE	 dependence. A Severity of Amphetamine
20016373	T4	che	monkeys were trained to self-administer 	CANDIDATE	 (0.1 mg/kg/injection) under a second-order
24452374	T1	ggp	proteins contribute to loss of 	CANDIDATE	 and bronchial epithelial barrier by
26663986	T1	org	Adipose Lipolytic Transcriptome in Obese 	CANDIDATE	. BACKGROUND: Dysregulated lipolysis has been
9338510	T18	ggp	stimuli for the release of 	CANDIDATE	 (ANP), we examined if ANP
21371473	T51	che	cyanide p-trifluromethoxyphenylhydrazone also decreased the 	CANDIDATE	-induced contraction but this was
29186592	T8	ggp	high flux dialyzers to remove 	CANDIDATE	. Studies were searched using ProQuest
9721705	T2	dis	recurrence occurs in 5-20% of 	CANDIDATE	 patients. Until recently, the only
27391144	T2	ggp	DOCSTART Intratumoral expression of 	CANDIDATE	 (COX-2) is a negative prognostic
7122017	T1	org	DOCSTART Electron microscopy of the 	CANDIDATE	 cerebral cortex in unstained, fresh
23597587	T8	org	cause of antimicrobial-associated diarrhea in 	CANDIDATE	 and may cause death. Previously,
29883692	T21	che	minutes. The potentiation induced by 	CANDIDATE	 is pertussis toxin - sensitive involving
21862940	T17	ggp	fragment of Nogo-A (Nogo-66) activated 	CANDIDATE	 and reduced the phosphorylation of
23990317	T21	org	typeable and non-typeable strains of 	CANDIDATE	 and selected mutants. The post-immune
6706284	T7	dis	in patients without evidence of 	CANDIDATE	 remains controversial. The possible reasons
24264149	T5	che	in 20,000 lx, indicating that 	CANDIDATE	 is not degraded. An analysis
11849731	T17	che	cells which were injured by 	CANDIDATE	. DOCEND
27528625	T18	ggp	to ER and enriched in 	CANDIDATE	 expression); in HER2-positive breast cancer,
22265017	T8	dis	external genital anomalies and severe 	CANDIDATE	. Using an exome-sequencing approach, we
22669473	T1	ggp	variants of the genes encoding 	CANDIDATE	 and its receptor modulate cognitive
6199955	T16	che	release process. The effects of 	CANDIDATE	 and prednisolone were qualitatively identical
18494262	T19	ggp	Expression analyses show that Nfia, 	CANDIDATE	 and Nfix are expressed in
18343556	T50	che	reduction from the action of 	CANDIDATE	, a metabolite of the sweetener
12588293	T47	ggp	it decreases the ET-1 concentration. 	CANDIDATE	 has no effect on NO
26382237	T6	dis	commonly accepted genes associated with 	CANDIDATE	 (PD). The overexpression of disease-associated
21597827	T18	che	ondansetron or metoclopramide. The median 	CANDIDATE	/creatinine ratios in the control
25403351	T23	dis	and inexplicable practices of some 	CANDIDATE	 centers only fuel these people's
24623181	T2	dis	complications of the disease, including 	CANDIDATE	, cardiomyopathy, and non-proliferative retinopathy. In
8679557	T12	che	amino acids such as cysteine, 	CANDIDATE	, and histidine were predominantly found
28239300	T21	ggp	KLF-4 could be silenced by 	CANDIDATE	, so as to restore the
26896692	T22	ggp	Western blot analysis showed that 	CANDIDATE	 TT genotype hepatocytes expressed higher
28865795	T29	che	and the analogues cystathionine and 	CANDIDATE	. Biochemical evaluation by radioactive uptake
2556656	T10	dis	receptors. The NG108-15 glioma x 	CANDIDATE	 hybrid cells have muscarinic receptors
23560594	T3	che	metastases: the emerging role of 	CANDIDATE	 for patients with melanoma and
16412476	T25	ggp	the present results suggest that 	CANDIDATE	 may be involved directly in
9694885	T29	ggp	Fas-mediated death, however, activation of 	CANDIDATE	 is completely inhibited to zVAD-fmk.
21223544	T9	ggp	genes were: for AA > CA, 	CANDIDATE	, AMFR, FGFR3; and for AA
25196524	T38	ggp	of ART on apoptosis and 	CANDIDATE	 expression in bladder cells. Moreover,
11035939	T11	org	by the so-called glucose effect, 	CANDIDATE	 is adapted to aerobiosis and
18184113	T2	ggp	cluster of abnormalities, including obesity, 	CANDIDATE	 resistance, dyslipidaemia and Type 2
20691177	T45	ggp	is able to bind both 	CANDIDATE	 and Cul3, mutation of Cand1
28585034	T5	dis	including for women with nonobstructive 	CANDIDATE	 and coronary microvascular dysfunction. With
10921445	T9	che	formation or resorption with either 	CANDIDATE	 administration. We undertook a non-randomized
11590760	T5	che	in both oxidation processes of 	CANDIDATE	/UV and O3 has been
2134298	T12	che	actinomycetemcomitans Y4 by the hot 	CANDIDATE	-water procedure (A-LPS). A marked
7349788	T2	dis	primary functions of a population-based 	CANDIDATE	 registry are to collect incidence
19129247	T12	org	S. cerevisiae TIY20 strain and 	CANDIDATE	 KT97 strain, respectively. TIY20, which
2137539	T12	che	The maximum capacity of the 	CANDIDATE	-dependent Ca2+ pump (Vm: 0.63
18946099	T1	che	compact linear array transducer. METHODS: 	CANDIDATE	, a hydrophilic agent, and papaverine,
10946261	T2	ggp	DOCSTART 	CANDIDATE	 increases production of B lymphoid
638909	T8	che	and minor determinants of benzylpenicillin, 	CANDIDATE	, cloxacillin, methicillin and cephalothin. The
9564841	T20	che	cells with calcium ionophore or 	CANDIDATE	. Our data further demonstrate that
10340590	T23	che	of time during which plasma 	CANDIDATE	 concentrations were comparable to those
15882952	T3	org	acidic fibroblast growth factor in 	CANDIDATE	. To decrease the potential side
5017229	T2	dis	[Role of diabetes mellitus and 	CANDIDATE	 in hospital mortality]. DOCEND
26974593	T20	che	measure lactate dehydrogenase (LDH) and 	CANDIDATE	 kinase MB (CK-MB). Doxorubicin significantly
29627988	T23	che	the weak intermolecular complexes of 	CANDIDATE	. DOCEND
12622787	T16	che	disease. Levels of NE, DA, 	CANDIDATE	, MN, MHPG, VMA and 5-HIAA
11862261	T8	che	hypoalgesic action through inhibition of 	CANDIDATE	 production. However, indiscriminate inhibition of
9816131	T3	org	receptor (EGFr) is expressed in 	CANDIDATE	 bronchial epithelial cells, and non-small
29249178	T11	che	of six carotenoids (alpha-carotene, beta-carotene, 	CANDIDATE	, lutein, lycopene, and zeaxanthin), three
29935254	T2	ggp	DOCSTART Novel 	CANDIDATE	 mutations in children with osteogenesis
620898	T2	che	reflux esophagitis. Effect of oral 	CANDIDATE	. The gastric emptying of the
28927936	T8	che	glucose in glucose injection with 	CANDIDATE	. The carbon dioxide (CO2) formed
24302378	T7	che	stimulation of the uptake by 	CANDIDATE	 (FC), inhibition by diethylstilbestrol (DES)
18032975	T18	dis	shown certain effects in the 	CANDIDATE	. Allogeneic stem cell transplantation (SCT)
23874588	T17	che	estrogen, estradiol, PSA, and total 	CANDIDATE	 were analyzed at baseline, mid-point,
15630309	T6	che	KCl concentration, while in the 	CANDIDATE	 system the forward extraction was
11596033	T1	che	Phase II trial of weekly 	CANDIDATE	 in second-line therapy for nonsmall
11611761	T1	dis	of insulin and control of 	CANDIDATE	. DOCEND
