17388704	T3	dis	OBJECTIVE: To determine rates of 	CANDIDATE	 and hypogonadism and establish the
3902566	T15	che	than 10fold increase (indirect UV-mutagenesis, 	CANDIDATE	, beta-chloroethyldiethylamine hydrochloride, nitrosoguanidine); no mutagenic
27182431	T13	che	the carbonyl oxygen atom of 	CANDIDATE	. This process may enable photoanomerisation
18056989	T32	ggp	localization and drug-resistant activity of 	CANDIDATE	 were compromised by T362A mutation.
7332430	T2	dis	with a high risk of 	CANDIDATE	 (SIDS), 3 groups of children
23935496	T18	org	of NHNP TLAs with cell-free 	CANDIDATE	 resulted in a persistent infection
15292103	T1	org	enzymes in normal and subfertile 	CANDIDATE	 semen. Opioid peptides have been
2753022	T4	che	carbamazepine and carbamazepine-10,11-epoxide in children. 	CANDIDATE	 (CBZ-E), the principal metabolite of
1599935	T8	org	protein has been isolated from 	CANDIDATE	 seeds and its amino acid
7365273	T9	che	cholestyramine more strongly than to 	CANDIDATE	. Cholestyramine and vancomycin were also
10064746	T16	ggp	found. It is possible that 	CANDIDATE	 stimulates flux simply by tethering
18689744	T8	che	in sorption. Variability in total 	CANDIDATE	 mineralization was particularly low, with
29458778	T13	che	There was no association between 	CANDIDATE	 diuretics, ACEi or ARB use
8148870	T20	che	N-demethylation by anti-CYP2C antibody and 	CANDIDATE	 also depended on the substrate
26808713	T10	ggp	increase in cells positive for 	CANDIDATE	, GATA4, Cx-43, and alpha-actinin. The
18978733	T21	dis	frequent in primary and secondary 	CANDIDATE	 and rare in squamous carcinoma.
2438329	T10	ggp	of the antigenic topography of 	CANDIDATE	 revealed that the immunodominant portion
9774577	T4	org	ecosystem, has been isolated from 	CANDIDATE	 clinical samples in rare instances,
4631311	T2	che	absorption of naturally occurring pteroylmonoglutamates (	CANDIDATE	) in man. DOCEND
21696967	T14	che	had lower oral absorption than 	CANDIDATE	 in rats, and lower bioavailability
12065081	T16	che	min before the administration of 	CANDIDATE	 also significantly reduced the emetic
24628291	T9	dis	as the localized form of 	CANDIDATE	 (EBS-loc). Eighteen different TGM5 mutations
21314830	T1	dis	in a patient affected by 	CANDIDATE	: a case report. AIM: To
23151909	T16	che	the 23 patients. The mean 	CANDIDATE	 concentration was relatively low (21
5821802	T2	che	DOCSTART The effect of thujaplicin (	CANDIDATE	) upon the general and cardiac
7588490	T6	che	environmental chamber to 100 micrograms/m3 	CANDIDATE	 and sodium chloride (control) aerosols
3124861	T3	che	16,000, respectively), as defined by 	CANDIDATE	-polyacrylamide gel electrophoresis. The proteins
2954839	T8	org	the excretion of the super-infecting 	CANDIDATE	 Nalr strain over several weeks
28341167	T18	dis	for differentiating bacterial meningitis from 	CANDIDATE	. The risk of having bacterial
23278596	T33	che	and decrease in CO during 	CANDIDATE	-remifentanil, but not sevoflurane, anesthesia
12837741	T26	che	multidrug resistance. We observed energy-dependent 	CANDIDATE	 efflux in cells of E.
9543195	T26	che	P. gingivalis LPS+ 100 microg/ml 	CANDIDATE	 relative to P. gingivalis LPS
14534745	T6	che	by a standard solvent-extraction procedure (	CANDIDATE	, phenol:Sevag, and Sevag; 23 degrees
1881998	T6	che	studying agents acting on brain 	CANDIDATE	. Increasing the period of food
20437098	T2	org	We recently provided evidence that 	CANDIDATE	 and likely also Mycobacterium bovis
17306703	T16	dis	placebo-controlled study, CHF patients with 	CANDIDATE	 (hemoglobin > or =9.0 to < or
25333417	T3	dis	to measure efficacy in some 	CANDIDATE	 clinical trials. These comparisons are
8069004	T29	dis	the potential for severe complications, 	CANDIDATE	 should be corrected promptly in
21752713	T21	ggp	an in vivo role for 	CANDIDATE	 in controlling inflammation and tissue
28501567	T17	che	Concomitantly, insulin stimulated uptake of 	CANDIDATE	 and fatty acids was significantly
10650839	T21	org	10 generations per year for 	CANDIDATE	, the effective population size in
2722854	T12	che	form, although both untreated and 	CANDIDATE	-grown cells appeared to synthesize
12837753	T26	ggp	initiated with at least partially 	CANDIDATE	-free TATA-binding protein. We also
2275360	T4	org	are safe for implantation in 	CANDIDATE	 eyes. DOCEND
9873196	T8	che	a specific RIA. In addition, 	CANDIDATE	, testosterone, and sex hormone binding
26671829	T9	org	CD4bs-directed NAbs from a Chinese 	CANDIDATE	-infected elite neutralizer. We first
25260175	T24	dis	association between PFOA exposure and 	CANDIDATE	 or coronary artery disease incidence.
8046461	T19	che	but not by NBTI or 	CANDIDATE	, and it was reduced in
17432211	T23	ggp	mediated polyubiquitylation of MJD1/Ataxin-3, and 	CANDIDATE	 interacted with both E 4B
18761146	T17	che	dinucleotide (NADH), ascorbic acid and 	CANDIDATE	. The proposed method was used
1745051	T13	ggp	of selected specimens confirmed that 	CANDIDATE	 overexpression was associated with mutation
3940705	T10	ggp	all were free from CK-MM, 	CANDIDATE	, and adenylate kinase interference. Only
21679420	T10	dis	lagtime between vaccination and averted 	CANDIDATE	. In most countries (68 for
25481799	T1	che	neural regeneration peptide 2945 on 	CANDIDATE	-induced seizures in rats. Neuron
16002426	T4	che	combination with high-dose etoposide and 	CANDIDATE	 followed by autologous stem cell
2708251	T6	che	with NaCl (warm hypertonic) or 	CANDIDATE	 (hypertonic glucose) added to result
24758076	T2	dis	of Chinese medical syndromes of 	CANDIDATE	 (RA) by literature retrieval. METHODS:
21383108	T5	dis	orthographic coding, and finger sequencing), 	CANDIDATE	 (impaired pseudoword reading, spelling, phonological
20930172	T8	ggp	Ca(2+) accelerated the rate of 	CANDIDATE	 generation (time to reach half
15717295	T26	dis	polymorphism in the development of 	CANDIDATE	 at least in the Irish
21402865	T22	org	chemotaxis sensors and restriction/modification systems. 	CANDIDATE	 possesses an episomally replicating 6.7-kb
18257744	T10	ggp	identified a direct interaction between 	CANDIDATE	 and Fas with recruitment of
7874388	T31	ggp	number of cells are expressing. 	CANDIDATE	 but only a small number
17984958	T16	che	free testosterone (214%), percent free 	CANDIDATE	 (121%), DHEA (192%), and androstenedione
9570015	T23	ggp	McAb-induced recruitment of ZAP-70 to 	CANDIDATE	 was observed to be blocked
18353639	T7	che	I. Novel diamine derivatives containing 	CANDIDATE	 were synthesized and evaluated for
1193735	T9	che	most active substances in the 	CANDIDATE	 extract were soluble in petroleum
2775456	T22	ggp	thyroid hormone from that of 	CANDIDATE	, showed no significant binding in
11929587	T8	ggp	within the tumor necrosis factor (	CANDIDATE	) region of HLA locus, and
7211197	T3	dis	affected by a hereditary neuropathy (	CANDIDATE	 musculorum). A teased fibre and
27694892	T5	dis	lung cancer invasion and metastasis. 	CANDIDATE	 is the leading cause of
1746419	T5	dis	relations persisted among patients with 	CANDIDATE	, although a different definition was
8222741	T7	che	orally with 3 doses of 	CANDIDATE	, 500 mg/6-hourly in adults or
26232325	T9	ggp	squamous cell carcinoma (OSCC). While 	CANDIDATE	 expression is associated to initiation
11347853	T3	dis	to the extension of the 	CANDIDATE	. In comparison with alternative techniques,
17206887	T36	che	target of rapamycin pathway; and 	CANDIDATE	, an inhibitor of the tyrosine
10540050	T21	dis	follow-up, 15 patients (33%) developed 	CANDIDATE	, nine of whom had moderate
24905733	T2	ggp	DOCSTART Axotrophin/	CANDIDATE	 acts as an E3 ubiquitin
28925117	T2	che	different pre-treatment methods, and the 	CANDIDATE	 content reached 119.50 mg*g-(1), followed
28447565	T20	ggp	BRAF, PIK3CA, PTEN, ERBB2 and 	CANDIDATE	 sequencing of DNA extracted from
6172609	T7	che	3 groups: control, castrated and 	CANDIDATE	 administration ones with 5 mg
2478796	T6	che	leading to the generation of 	CANDIDATE	. Cyclic AMP increases the slow
8062243	T25	ggp	activity toward AFBO, six chimeric 	CANDIDATE	/rYc1 GST enzymes were generated
1939555	T27	che	the protection of LDH from 	CANDIDATE	 is discussed. DOCEND
28439492	T19	dis	signals and expansion of the 	CANDIDATE	 stem cell sub-populations. DOCEND
9688224	T9	dis	of 33 (78.8%) patients with 	CANDIDATE	 were 'much better', as were
16328166	T8	che	spinal rats. Prolonged use of 	CANDIDATE	 induced significant hyperpolarization of the
18094581	T4	dis	kinase activity in patients with 	CANDIDATE	]. BACKGROUND: The multidrug resistance (mdr1),
17948991	T8	che	in three steps starting from 	CANDIDATE	, and its coordination behavior toward
22804575	T38	che	could be constructed by hexanal, 	CANDIDATE	, (E)-2-heptenal, (E)-2-octenal, heptanal, isospathulenol, (E,E)-2,4-decadienal,
20400979	T35	ggp	correlated with the phosphorylation of 	CANDIDATE	 overtime. FAK phosphorylation was strongly
12747741	T13	che	acid, also increased mean plasma 	CANDIDATE	 concentrations, but not significantly (23
494436	T4	org	mechanism involving the glucocorticoid receptor, 	CANDIDATE	 renal cell carcinomas obtained from
830402	T1	che	carcinogenesis in mice treated with 	CANDIDATE	. Genetic analysis of colon tumor
11116524	T2	org	characterization of serum immunoglobulins of 	CANDIDATE	. Serum immunoglobulins of O. mossambicus
25811716	T3	dis	be the delayed development of 	CANDIDATE	 and metabolic disease. We document
12674373	T7	org	sunflower root length. Chlorimuron decreased 	CANDIDATE	 and sunflower root length regardless
25015125	T24	org	in E. coli isolates from 	CANDIDATE	 was higher than expected. In
18199557	T12	ggp	lymphocytic leukemia). ScFvRit:sFasL efficiently activated 	CANDIDATE	 and Fas apoptotic signaling, resulting
13719400	T2	dis	Syme's amputation for gangrene from 	CANDIDATE	. DOCEND
6978289	T13	org	although spleen cells from these 	CANDIDATE	 failed to adoptively transfer suppression.
29925021	T7	ggp	thermodynamically distinct steps in the 	CANDIDATE	 activation pathway and show that
12397176	T30	ggp	proliferation induced by tryptase and 	CANDIDATE	 agonist peptide can be blocked
18714642	T11	dis	The majority of patients with 	CANDIDATE	 had skin lesions with oral
5952898	T1	che	DOCSTART Synthesis of 	CANDIDATE	. DOCEND
8331532	T15	che	estimated p0 value for un-ionized 	CANDIDATE	 and hydroxychloroquine transport across the
28757346	T4	dis	lack of effective treatments for 	CANDIDATE	 (UC), a recurrent and intractable
12149410	T18	ggp	(SMC) and to determine if 	CANDIDATE	/ERbeta are differentially expressed in
1684211	T6	che	male ingested 25 g of 	CANDIDATE	 in a suicide attempt. He
10514305	T22	che	known compounds from B. officinalis-calceolarioside, 	CANDIDATE	, verbascoside, echinacoside, forsythoside B, angoroside
20053374	T22	org	and improves neurological outcomes in 	CANDIDATE	 after focal cerebral ischemia. Taken
22661906	T9	dis	In conclusion, cognitive therapy for 	CANDIDATE	 can be successfully disseminated in
18441535	T3	dis	vaginal agenesis and one with 	CANDIDATE	. The rhombus-shaped abdominal flap was
12359483	T10	ggp	these data may suggest that 	CANDIDATE	 concentrations are altered in response
3435841	T10	che	cyclo(His-Pro) potentiates hypothermia induced by 	CANDIDATE	. These results suggest that cyclo(His-Pro)
18275568	T6	org	During the first trimester, primary 	CANDIDATE	 infection may result in stillbirth
22495907	T24	che	gene may interact with dietary 	CANDIDATE	 intake and modify the conotruncal
26780199	T2	che	the salience attribution and the 	CANDIDATE	 system could explain the correlation
26645811	T1	dis	in Anovulatory Chinese Women with 	CANDIDATE	. OBJECTIVE: To evaluate the effects
9121315	T14	dis	TNF in the middle ear. 	CANDIDATE	 was induced in chinchillas by
14462311	T2	che	DOCSTART [Action of histamine and 	CANDIDATE	 in repeated local injections, on
24802713	T25	che	biopsy neuroinflammation model demonstrated that 	CANDIDATE	 completely inhibited vasodilation induced by
24070603	T35	org	AP-1 DNA binding activity in 	CANDIDATE	 oral cancer cells. Inhibition of
19424638	T17	che	of polychlorinated biphenyls (PCB), p,p'-dichlorodiphenyldichloroethyelene (	CANDIDATE	), hexachlorobenzene (HCB), seven subgroups of
7196260	T14	che	least 6% of the stereospecific 	CANDIDATE	 transport activity. At cholate concentrations
15857103	T16	che	systemically. However, systemic administration of 	CANDIDATE	 only slightly enhances osseointegration. DOCEND
7515737	T10	che	of treatment with 30 mg 	CANDIDATE	 daily. In line with similar
10089335	T6	che	toxic oxyanions arsenite (AsIIIO2-) and 	CANDIDATE	 (SbIIIO2-) via an ATP-driven pump.
16024515	T7	ggp	endocytosis. The round trip of 	CANDIDATE	 is intricately regulated by diverse
1979205	T14	org	a 4-year period in 518 	CANDIDATE	-seropositive men enrolled in the
20701403	T32	che	the analgesic efficacy of tramadol/	CANDIDATE	 did not differ significantly from
21638738	T1	org	DOCSTART Song: the 	CANDIDATE	 song (to the tune of
28482410	T24	org	(CCl(4)+G-Rg1) group, and an ALF 	CANDIDATE	 model was established by CCl(4)
22744889	T7	che	(see scheme; cod = 1,5-cyclooctadiene, DCE = 	CANDIDATE	). This catalytic system exhibits good
1386362	T17	che	reduction of the photolyzed chromophore 	CANDIDATE	 to all-trans-retinol is essential for
17453295	T1	org	and its analog, GDF-9b/BMP-15, in 	CANDIDATE	 breast cancer. BACKGROUND: There has
24695957	T2	org	disease, but also to enhance 	CANDIDATE	 disease diagnosis and treatment. Recently,
18563374	T2	dis	a microdialysis study]. BACKGROUND: In 	CANDIDATE	 (MH), volatile anesthetics induce hypermetabolism,
1704845	T2	ggp	stem cell factor synergises with 	CANDIDATE	, G-CSF, IL-3 and epo to
24304906	T20	ggp	points. A significant correlation between 	CANDIDATE	 and CRP concentrations was found
11202859	T3	org	from explants of extracted healthy 	CANDIDATE	 teeth. Plates with confluent PDLF
25996749	T4	org	injury mechanisms using Post Mortem 	CANDIDATE	 Surrogates (PMHS) in a controlled
10648556	T7	ggp	the control of protein synthesis. 	CANDIDATE	 binds to the mRNA 5'
2098546	T16	che	the oral administration of S(+)-	CANDIDATE	 to mice at a dose
18193477	T15	che	Assay application was tested measuring 	CANDIDATE	 plasma levels in 50 healthy
8968517	T13	ggp	of bone-associated cytokines (IL-1 beta, 	CANDIDATE	, TNF-alpha and TGF-beta 1) by
28293196	T17	ggp	activation is related to liver 	CANDIDATE	 sensitivity and circulating hepatokines CRP
24681153	T22	ggp	to characterize the recognition of 	CANDIDATE	. This novel immunosensor, works well
19482302	T6	che	enzyme, malondialdehyde levels, and inducible 	CANDIDATE	 synthase expression were each evaluated
9341148	T22	org	within the EGF-like domain of 	CANDIDATE	 DTR/proHB-EGF with the corresponding amino
28696328	T7	org	on exploitation of a "dirty" 	CANDIDATE	 model that better mimics the
3134151	T17	che	and in vivo effects of 	CANDIDATE	 on various immunological parameters including
21071512	T44	ggp	and tumor promoting function for 	CANDIDATE	, which is involved in TGF-beta-induced
19626889	T13	che	to the emission from the 	CANDIDATE	 anion. DOCEND
22006791	T15	dis	The current standard therapy for 	CANDIDATE	--high-dose phosphate and calcitriol--further increases
8642801	T17	org	to be demonstrated conclusively in 	CANDIDATE	. DOCEND
9845092	T61	ggp	AQ4N requires anaerobic conditions for 	CANDIDATE	-mediated reduction and hence this
9852068	T28	org	which fails to interact with 	CANDIDATE	 TFIID, TATA-binding protein in vitro.
12611960	T21	che	of motoneurons and that functional 	CANDIDATE	 receptors are required for this
25853264	T20	org	slightly delayed compared to control 	CANDIDATE	, but tumor multiplicity was increased.
8298824	T9	che	responders could be distinguished from 	CANDIDATE	 responders by greater weight loss.
23714449	T11	dis	treatment options for patients with 	CANDIDATE	 patients who have low-risk disease.
9001970	T7	che	limit for accurate quantitation of 	CANDIDATE	 was 0.25 microgram/ml. Between 6
9952127	T1	che	DOCSTART Transluminal angioplasty and intra-arterial 	CANDIDATE	 for the treatment of cerebral
28776218	T21	ggp	demonstrated higher expression of IL-1beta, 	CANDIDATE	 and iNOS, and lower expression
26546227	T5	org	in the Oryza sativa and 	CANDIDATE	 genomes were carried out. Furthermore,
29295704	T3	org	metabolism of Hevea brasiliensis (the 	CANDIDATE	). BACKGROUND: Acyl-CoA-binding proteins (ACBPs) are
18963789	T8	che	mixture of H(2) + CO(2) with 	CANDIDATE	 and ZnSe surfaces, to determine
8288910	T7	dis	ligation process. The cells from 	CANDIDATE	 patients were as effective as
10505659	T12	che	serum albumin) were carried out. 	CANDIDATE	 (MDI) and MDI prepolymer exposure
2463903	T28	ggp	paralleled the inhibitory effects of 	CANDIDATE	 on cell growth. Thus, IFN
5681483	T1	org	and after splenectomy in the 	CANDIDATE	. DOCEND
15667276	T2	che	hydrogen-sensing multiprotein complex controls aerobic 	CANDIDATE	 metabolism in Ralstonia eutropha. H(2)
10197447	T13	ggp	with the observation of deregulated 	CANDIDATE	 levels in tumor cells and
7481092	T18	org	AIDS children. Sera from the 	CANDIDATE	-infected children showed reactivity to
8439116	T12	ggp	normal aspartate aminotransferase (AST) and 	CANDIDATE	 (ALT) values and a definite
9115504	T3	dis	benefits of early detection of 	CANDIDATE	 through screening with physical examination
21282106	T39	ggp	lung epithelial cells by lowering 	CANDIDATE	 expression and thereby activating the
11154121	T13	che	This effect was inhibited by 	CANDIDATE	. In non-aspirinated PRP, there was
29115545	T8	dis	to create the models of 	CANDIDATE	 in rats. The expression levels
24099863	T20	ggp	factors (FOXD1, FOXL2, FOXO1 and 	CANDIDATE	) in gonadotropin hormone production and
21038862	T3	che	enhancement of about 500% for 	CANDIDATE	 was observed in one lot
12047705	T3	dis	a child. Familial hyperparathyroidism and 	CANDIDATE	 are rare diseases. A case
9117915	T2	dis	thyroid hormone therapy on angiographic 	CANDIDATE	 progression. OBJECTIVE: To study the
12688740	T2	che	diastereoselective C-C bond formation in 	CANDIDATE	-modified carbohydrates: a general route
21631707	T2	ggp	DOCSTART Assessment of a point-of-care 	CANDIDATE	 test to differentiate cardiac from
27214797	T19	dis	family caregivers of people with 	CANDIDATE	. DOCEND
11709424	T12	ggp	signal-regulated kinase (ERK) activation in 	CANDIDATE	 induction following exposure to IL-1
16704309	T7	che	in adipose tissues. FABP4 binds 	CANDIDATE	 with high affinity and transports
13136651	T1	che	DOCSTART [New function of 	CANDIDATE	 in amino acids metabolism, splitting
494438	T12	dis	of antibiotic therapy in embolized 	CANDIDATE	 is discussed. DOCEND
19700016	T1	dis	patients with severe forms of 	CANDIDATE	. BACKGROUND: The Dystrophic Epidermolysis Bullosa
9059849	T28	che	aggregation ex vivo. In contrast, 	CANDIDATE	 (30, 100 micrograms/g) did not
9135735	T20	org	gene transfer to resting, normal 	CANDIDATE	 PBMC, assayed on unselected cells,
3750277	T5	ggp	their prevention. Adsorption loss of 	CANDIDATE	 may produce considerable systematic error
2596860	T21	che	G2 phase was observed, thus, 	CANDIDATE	 appeared to have a similar
12631407	T2	ggp	of P-gp substrates: a review. 	CANDIDATE	 (P-gp), a well characterized efflux
1468301	T18	ggp	very low levels of GLUT4. 	CANDIDATE	 expression appears to be regulated
22574202	T3	org	induces apical endocytic trafficking in 	CANDIDATE	 corneal keratinocytes. BACKGROUND: Exposed mucosal
13670671	T1	che	DOCSTART The action of 	CANDIDATE	 and nor-adrenaline on the knee-jerk.
1274788	T1	dis	Study of drugs affecting cholesterol-induced 	CANDIDATE	 in rabbits. 1. Effects of
21252986	T1	ggp	associated with higher expression of 	CANDIDATE	 and immune responses to BMI-1
8504974	T18	dis	acid malabsorption in patients with 	CANDIDATE	. DOCEND
7519010	T16	ggp	of approx. 120 kDa (pp116, 	CANDIDATE	 and pp130) and two of
8381796	T13	org	receptors in these regions in 	CANDIDATE	 and monkey tissue specimens by
28630188	T19	org	strains and clinical isolates of 	CANDIDATE	 Further characterization of the compound
27078020	T1	org	Annexin A2 Decreases Infection of 	CANDIDATE	 to Gastric Cancer Cells. DOCEND
29931944	T10	ggp	were cultured and treated with 	CANDIDATE	 (TGF-beta 1) to establish cardiac
10802071	T9	che	platelets, although the level of 	CANDIDATE	 formation was greater and its
27725121	T18	ggp	detected a significant increase of 	CANDIDATE	 levels in progressive MS patients
20108279	T16	che	between the 3-substituent of the 	CANDIDATE	 and the 3- and 3'-substituents
15385127	T14	che	(range 33-77), were treated with 	CANDIDATE	 85 mg m(-2) as a
21347559	T15	ggp	of interleukin-1 beta (IL-1beta), interleukin-6 (	CANDIDATE	), myleoperoxidase (MPO), and monocyte chemoattractant
17617082	T10	ggp	studied the expression of the 	CANDIDATE	 (TfR) which is called as
5478282	T1	che	DOCSTART Binding of 	CANDIDATE	 to human plasma proteins. DOCEND
28717545	T19	che	procedures. This study shows lignocaine + 	CANDIDATE	 is preferable over bupivacaine for
7537539	T1	org	of physiological levels of functional 	CANDIDATE	 factor VIII in mice. Hemophilia
23574265	T17	che	to an equivalent dose of 	CANDIDATE	 IR administered twice daily. Quetiapine
9605936	T9	org	receptor: cells were infected with 	CANDIDATE	 encoding a dominant negative dynamin,
414664	T13	che	returned to control values. Plasma 	CANDIDATE	 curves were normal at this
1941633	T30	che	exhibited significant arrhythmogenic activities. During 	CANDIDATE	 infusion, most dogs exhibited some
23888368	T19	che	parameters of muscle strength and 	CANDIDATE	, ionized calcium (Ca2+), PTH and
7291992	T2	che	DOCSTART Effect of 	CANDIDATE	 on intestinal tumors induced in
16424008	T4	dis	stabilization of hypoxia-inducible factor-1alpha in 	CANDIDATE	: role of free radical formation.
18570431	T23	che	present a higher content of 	CANDIDATE	 and ethyl lactate than those
9483569	T36	ggp	be co-localized with beta-catenin and/or 	CANDIDATE	 in neurons and nerve fibres,
25658587	T6	che	(RA), the end-product of the 	CANDIDATE	 metabolism pathway, induced in vitro
24526686	T48	ggp	translocation and surface expression of 	CANDIDATE	. In summary, this study identifies
17517919	T20	org	IFN-alpha2 exhibits 8 optimal interactions, 	CANDIDATE	 IFN-alpha1, 7, and murine IFN-alpha4
6553561	T10	che	B or CVF X Bb. 	CANDIDATE	 was a non-competitive inhibitor of
24371091	T1	org	DOCSTART Offending and victimization: the 	CANDIDATE	 or the egg? How to
12215545	T13	ggp	protein we refer to as 	CANDIDATE	 (NRC-interacting factor 1). NIF-1 was
25780798	T15	ggp	system (Nav1.6, Nav1.7). The isoform 	CANDIDATE	, encoded by the SCN5A gene,
12848832	T1	dis	intervention for rural women with 	CANDIDATE	: The Sierra-Stanford Partnership. OBJECTIVE: This
3982854	T9	org	identified as Aspergillus sclerotiorum and 	CANDIDATE	. Fungi-infected laboratory reared P. papatasi
15028841	T6	org	production was characterized in vitro. 	CANDIDATE	 fetal lung fibroblast and alveolar-epithelial-like
1999271	T18	che	no cross-reactivity with the other 	CANDIDATE	-transporter isoforms GLUT2 and GLUT4.
29424025	T26	che	significantly increased levels of cleaved 	CANDIDATE	 polymerase, cleaved caspase-3, cleaved caspase-9,
26633544	T20	ggp	of 0.00007 to 0.0005. Significantly, 	CANDIDATE	 variants that have been previously
632595	T1	org	DNA synthesis and proliferation of 	CANDIDATE	 lymphocytes in vitro. I. Cell
15381186	T7	ggp	such as interleukin-6 (IL-6) and 	CANDIDATE	 (TNF-alpha) may have a direct
8262912	T1	org	DOCSTART Two 	CANDIDATE	 hypervariable minisatellites: chromosomal location and
16446154	T1	org	DOCSTART Decreased mortality in a 	CANDIDATE	 model of acute postinfarction heart
24396579	T5	che	and 10 non-molar (hydropic abortions) 	CANDIDATE	-fixed, paraffin-embedded tissue samples. Ploidy
22465711	T17	ggp	in the conserved IMD domain (	CANDIDATE	 and MIM (missing in metastasis)
8055195	T33	ggp	molecule CR3 (CD11b/CD18) and of 	CANDIDATE	 but significantly lower levels of
19960204	T7	che	aluminum stress in transgenic tobacco. 	CANDIDATE	 (Al) inhibits plant growth partly
16701985	T13	ggp	is more closely related to 	CANDIDATE	 than Numb. znumb mRNA was
22102402	T6	che	chromatography with tandem mass spectrometry. 	CANDIDATE	 is a coumarin compound naturally
15653539	T8	che	across treatments. Plasma acetate and 	CANDIDATE	 decreased, whereas glucose, nonesterified fatty
10737934	T7	che	change to alpha-helix with increasing 	CANDIDATE	 content. Singular value decomposition was
27278054	T14	dis	patients with both ASD and 	CANDIDATE	 over the course of 24
29479438	T8	dis	and monitoring of complications of 	CANDIDATE	 provides a sophisticated avenue for
24842190	T2	che	DOCSTART N-methyl-D-aspartate receptors involved in 	CANDIDATE	-induced hyperalgesia in sensitized mice.
20413678	T10	org	in both cell lines and 	CANDIDATE	 tissues. Moreover, this study might
2606386	T4	che	mg/kg pregnant female body weight), 	CANDIDATE	 administered on the 16th day
16178864	T14	che	the titres and affinities of 	CANDIDATE	 induced anti-MPO antibodies in sera
12663330	T26	che	on tension and [Ca2+]i by 	CANDIDATE	, indicating that the mechanism of
438653	T36	che	that the conversion of 7alpha-hydroxy-4-cholesten-3-one, 	CANDIDATE	, and 5beta-cholestane-3alpha,7alpha,26-triol to both chenodeoxycholic
29208590	T2	dis	patient subgroups (eg, individuals with 	CANDIDATE	, older patients, adolescents, and minority
10702885	T2	che	impairment on the pharmacokinetics of 	CANDIDATE	 and its metabolites. OBJECTIVE: The
28830578	T28	ggp	pneumotropica, and C. bovis. Therefore, 	CANDIDATE	-null mice may serve as
15700135	T31	ggp	was up-regulated by treatment with 	CANDIDATE	 (insulin resistance-promoting cytokine), and down-regulated
27215290	T14	che	by menopause status. METHODS: Serum 	CANDIDATE	 concentrations (BDEs 47, 99, 100
1024749	T1	dis	[How to detect and follow 	CANDIDATE	 in daily practice. Study of
