28254882	T8	org	addition, the bombykal receptor of 	CANDIDATE	 BmOr3 coexpressed with MsexOrco responded
20193369	T20	ggp	96.22%. Activity examination indicated that 	CANDIDATE	 could inhibit the growth of
19434533	T2	dis	systemic chemotherapy alone for serosa-involved 	CANDIDATE	. METHODS: According to the criteria
1374096	T9	ggp	cells are stimulated with TNF-alpha. 	CANDIDATE	 stimulates expression of vascular cell
15344597	T2	dis	DOCSTART Thrombin-mediated cellular events in 	CANDIDATE	 associated with systemic sclerosis (scleroderma).
15282677	T1	ggp	thrombocytosis: possible role of altered 	CANDIDATE	 production. Familial thrombocytosis (FT) is
9220946	T2	dis	DOCSTART 	CANDIDATE	 epidemic on Manitoba reserve. DOCEND
23901442	T4	dis	cases). Among the 1,080 extended 	CANDIDATE	 surgeries, 794 cases (73.5%) were
16593565	T9	org	disk protein, as well as 	CANDIDATE	 (CGMMV) protein, and three strains
22491464	T3	org	haplotypes with disease progression after 	CANDIDATE	 challenge in burmese rhesus macaques.
18092972	T10	org	accounted for 78.6% of cases, 	CANDIDATE	 (Welch) for 21.4% and mixed
26490658	T3	che	to weight loss and improves 	CANDIDATE	 homeostasis in obese animals. Injection
20701554	T7	dis	majority of people diagnosed with 	CANDIDATE	 have advanced disease. AREAS COVERED
1388954	T2	che	with a mixture of 35% 	CANDIDATE	 and sodium perborate, combined with
18298939	T16	che	not only counteracts mutually with 	CANDIDATE	 (NA) and GTPgammaS-induced I(Ca) inhibition,
17442841	T25	ggp	the EC1 domain and the 	CANDIDATE	 loop create a variety of
3545615	T23	che	disease on the pharmacokinetics of 	CANDIDATE	. Based upon the drug's pharmacokinetics
8856511	T3	ggp	and regulation of interstitial collagenase (	CANDIDATE	) are related to menstrual breakdown
11196858	T4	che	hydrothermal investigation of the 1/2V2O5-H2C2O4/H3PO4/	CANDIDATE	 system: synthesis and structures of
9084524	T28	dis	group. Besides, the incidence of 	CANDIDATE	 in fentanyl group (40%) was
6440907	T13	ggp	in the radial immunodiffusion plates. 	CANDIDATE	 levels were not detectable in
23405946	T23	dis	osteopetrosis, and immunologic investigation revealed 	CANDIDATE	 and mixed T- and B-cell
7982643	T13	org	and hepatitis B virus and 	CANDIDATE	 markers. Signs suggestive of chronic
28911764	T17	org	2015, using the key terms "	CANDIDATE	", "respiratory syncytial virus", or "respiratory
24315522	T10	dis	for understanding and treatment of 	CANDIDATE	.  DOCEND
28781824	T1	che	DOCSTART Effectiveness of continuous low-dose 	CANDIDATE	 on refractory coronary vasospasm subsequent
9549649	T2	org	and hypotension associated with a 	CANDIDATE	 model of the Bezold-Jarisch reflex.
25884677	T30	che	that underlying diabetes or impaired 	CANDIDATE	 tolerance may confer reduced autonomic
2025851	T17	che	therefore, the recommended dose of 	CANDIDATE	 is 250 mg/m2. The recommended
3093647	T14	che	selenium (Se) as either Na2SeO3, 	CANDIDATE	 or a high Se yeast
28577401	T43	che	life in the presence of 	CANDIDATE	. This work demonstrates that the
10762592	T15	org	indicators. The advent of transgenic 	CANDIDATE	 models of prostate cancer may
20863825	T4	dis	contributes to the development of 	CANDIDATE	. The objective of the present
28137817	T19	ggp	the mean cumulative amount of 	CANDIDATE	 excreted into the bile and
22110608	T26	ggp	DNA repair and suggest that 	CANDIDATE	 may act as a gatekeeper
15732744	T17	che	para-aminosalicylic acid, and 78.79% to 	CANDIDATE	. DOCEND
26507163	T12	ggp	fumigatus) hyphae, and explore whether 	CANDIDATE	 can inhibit the cell activations
26821351	T36	ggp	alone or in combination with 	CANDIDATE	 inhibitors which could impact future
16614352	T8	dis	most mild 20th percentile of 	CANDIDATE	 and (2) identifying differences in
20051210	T5	che	Salmonella enterica in fruit juices. 	CANDIDATE	 (CA), a naturally occurring organic
24355917	T8	org	or II TGF-beta receptors. These 	CANDIDATE	 exhibited several LDS-associated phenotypes. Despite
10869368	T46	dis	of 7-OH-DPAT. Suppression of 7-OH-DPAT-induced 	CANDIDATE	 by D(3) receptor antagonists (U-99194A
23484829	T1	dis	Increased oxidative metabolism in the 	CANDIDATE	. There is growing evidence that
19302416	T12	che	pO(2) and pCO(2)), metabolism (lactate, 	CANDIDATE	, ATP content), in vitro function
16317086	T40	dis	in a cocultured system with 	CANDIDATE	 cells. The activity of matrix
2429996	T12	che	brain. Significant amounts of endogenous 	CANDIDATE	 were detected in the lamina
733664	T1	che	DOCSTART [Indices of 	CANDIDATE	 binding to plasma proteins in
12102473	T7	che	two different combination therapies with 	CANDIDATE	 (PDN), methotrexate (MTX) and cyclosporine
19696011	T5	ggp	implantation. Vascular endothelial growth factor (	CANDIDATE	) has emerged as one of
19715307	T21	che	concentration of 5 mM of 	CANDIDATE	 moieties (valence-corrected value) per assay.
6085530	T23	che	reduces the haloperidol-increased content of 	CANDIDATE	, potentiates apomorphine stereotypy and reduces
3408251	T7	dis	adenocarcinoma, large cell carcinoma and 	CANDIDATE	, but prognoses of stage I
22798430	T15	ggp	of the cyclin-dependent kinase inhibitor 	CANDIDATE	. RBM38 levels are altered in
6585594	T40	che	plus NaCl were statistically significant. 	CANDIDATE	 given alone after MNNG administration
19118567	T37	org	induce enzymes in rat and 	CANDIDATE	 hepatocytes increases the throughput and
12423671	T10	che	the electroretinogram, a decrease in 	CANDIDATE	 synthase and Thy-1 immunoreactivities, a
12556907	T3	ggp	regulating protein of 132 kDa (	CANDIDATE	) was cloned and demonstrated to
26951992	T8	che	we aimed to study serum 	CANDIDATE	 (25(OH)D) level and its association
15497172	T19	che	compared azithromycin to amoxycillin or 	CANDIDATE	/clavulanic acid in patients with
19752637	T1	dis	family caregivers of veterans with 	CANDIDATE	. Caring for veterans with dementia
16842082	T15	org	primates (SIV), cats (FIV), and 	CANDIDATE	 (BIV), and those that cause
12562079	T13	che	by selective 1D-NOE experiments. Besides 	CANDIDATE	, luteolin and centaureidin, beta-sitosterol, 3beta-hydroxy-11alpha,13-dihydro-costunolide,
12431980	T41	ggp	signaling enzymes including phosphatidylinositol 3-kinase, 	CANDIDATE	, and protein kinase C had
29501530	T2	dis	A synaptic-derived plasma biomarker in 	CANDIDATE	. Synaptic neurodegeneration is thought to
21559498	T18	dis	between the 15q25 variation and 	CANDIDATE	 risk (OR = 1.09, 95% CI:
16516444	T15	ggp	normal stromal cells but not 	CANDIDATE	. Nutrient deprivation induced MMP-2 activation
19821270	T29	che	a trial of azathioprine or 	CANDIDATE	 therapy. Adverse events were more
3789327	T6	che	was compared with that of 	CANDIDATE	 in ordinary tablets (Bricanyl), 2.5
25317220	T16	dis	variables and the presence of 	CANDIDATE	 was evaluated. After hierarchical analysis
6653441	T5	che	alveolar macrophages with chloroform: iso-amyl-alcohol:	CANDIDATE	 extraction. Nucleic acids were precipitated
1580330	T5	org	evaluating the severe combined immunodeficiency 	CANDIDATE	-human peripheral blood lymphocyte (SCID-PBL)
19152932	T6	che	decreased after the initiation of 	CANDIDATE	 from 1.89 to 0.46 stones
1583245	T29	che	and enhances BK-induced glycoconjugate secretion. 	CANDIDATE	 does not alter BK-induced vascular
16256962	T41	ggp	module. To further prove whether 	CANDIDATE	 activation in ischemic hippocampus is
16356188	T18	che	(COX)-2 selectivity. As a control, 	CANDIDATE	 (a selective COX-1 inhibitor) was
19393822	T7	che	dysfunction and decreased bioavailability of 	CANDIDATE	 (NO). Naproxcinod, an investigational drug,
24388991	T34	ggp	(P<0.05). The expression of Shh, 	CANDIDATE	 and Gli1 at the mRNA
26162286	T8	org	has altered the course of 	CANDIDATE	 disease, with longer survival of
8865415	T8	dis	x-ray stage II and III 	CANDIDATE	, bronchoscopy with bronchoalveolar lavage (BAL)
7781039	T29	org	pomatia agglutinin (HPA) for N-acetyl-D-galactosamine, 	CANDIDATE	 agglutinin (RCA-I) for galactose and
25463523	T18	org	autism spectrum disorders (ASD). En2(-/-) 	CANDIDATE	 present molecular, neuropathological and behavioral
16619000	T38	ggp	and/or hMSH2 (P=0.014) but not 	CANDIDATE	 (P=0.57). Mismatch repair, and consequently
18451927	T2	org	to DIC images of the 	CANDIDATE	 fovea. DOCEND
23869429	T15	che	peritoneal macrophages as well as 	CANDIDATE	 (NO) in blood plasma were
8056364	T1	che	[Postpartum ovarian physiology. Pituitary gonadotropins, 	CANDIDATE	 and prolactin during 12 months
19625527	T2	org	the glabrous skin of the 	CANDIDATE	 hand. Little is known about
11163082	T1	dis	Association of IL-10 genotype with 	CANDIDATE	. Sudden infant death syndrome (SIDS)
20087411	T3	org	the rate reported for the 	CANDIDATE	. The local recombination rate in
18669034	T8	che	a positive dependence on the 	CANDIDATE	/water distribution coefficient at pH
25136665	T6	ggp	the kinetics of 4N-acetyl-pentapeptides, Ac-P1, 	CANDIDATE	, Ac-P3, and Ac-P4, regarding inhibition
18093543	T17	ggp	underlines the versatility of the 	CANDIDATE	 fold. Here, we primarily explore
19139049	T6	dis	with recurrent episodes of focal 	CANDIDATE	 primarily affecting the brachial plexus.
20812023	T17	ggp	specificity of Zn(2+) in activating 	CANDIDATE	 suggest it to be a
29439249	T22	ggp	RESULTS: Immunohistochemical staining revealed that 	CANDIDATE	 was highly expressed in human
24630594	T16	dis	the protective role of doxycycline 	CANDIDATE	 chemoprophylaxis may help to understand
28964787	T24	che	SIRT1 via direct phosphorylation in 	CANDIDATE	-mediated senescence in hepatoma cells.
29399068	T22	ggp	(P<0.05). Finally, the expression of 	CANDIDATE	 effector proteins, namely ankyrin repeat
17190649	T10	ggp	we compared serum/plasma pro-inflammatory cytokines, 	CANDIDATE	 (CRP), and cardiac troponin T
1854633	T8	che	follow up was 11 years. 	CANDIDATE	 receptors were present in 396
24288589	T10	che	contrast is achieved with low 	CANDIDATE	 loading (2.66% by weight) within
12744817	T13	dis	their relationship to aging and 	CANDIDATE	 have now been elucidated. These
23975862	T33	org	demonstrate that in infected Casp1(KO) 	CANDIDATE	, IFN-gamma production is due to
14576538	T9	che	induction via a facemask: 0% 	CANDIDATE	 with 1.2, 1.4, 1.6, 1.8,
12408888	T5	che	diminazene aceturate, antipyrine (excipient) and 	CANDIDATE	 impurities in pharmaceutical formulations is
29150788	T24	ggp	of all GBM-PN cases while 	CANDIDATE	 was positive in conventional GBM
29765617	T7	ggp	lupus models, the role of 	CANDIDATE	 remains unclear. In the present
19998792	T13	ggp	The markers (Ki67, HMB45 and 	CANDIDATE	) have been used retrospectively on
16171779	T27	ggp	not an S5a-interacting motif in 	CANDIDATE	, our further studies revealed that
2556904	T7	org	viral envelope glycoproteins. Immunohistology localised 	CANDIDATE	 to areas of liver necrosis
14464850	T1	dis	biology of these vectors of 	CANDIDATE	, sandfly fever and kalaazar. The
9312536	T1	dis	DOCSTART [The effect of 	CANDIDATE	 and cholelithiasis on the course
21274264	T5	dis	problems, including diabetes, cardiovascular disease, 	CANDIDATE	, muscle weakness, and cancer. The
24647156	T48	ggp	in the G2/M-phase by activating 	CANDIDATE	(wafl /cip1) and p53 in
16954616	T14	che	rings (six-, 14- and 20-membered). 	CANDIDATE	 bonds between the water molecule
21890689	T3	org	Myocardial injury after ischemia-reperfusion in 	CANDIDATE	 deficient in Akt2 is associated
6114174	T20	che	desaturase activity. In presence of 	CANDIDATE	 and CoA, either NAD or
12404552	T4	che	the efficacy and tolerability of 	CANDIDATE	 versus haloperidol in subchronic schizophrenia,
10762088	T29	che	high-affinity glutamate transporters, but that 	CANDIDATE	 may bind to a site
1319016	T26	ggp	also caused an increase in 	CANDIDATE	 immunoreactivity (about 2-fold, and blocked
4200916	T1	org	cell-wall in a mutant of 	CANDIDATE	. DOCEND
29263237	T2	org	To investigate this in the 	CANDIDATE	 (male and female) brain noninvasively,
6330200	T35	ggp	a dose-related manner by purified 	CANDIDATE	 but not by insulin or
20557631	T2	org	patterns of wild Atlantic salmon 	CANDIDATE	 smolts in the River Bush,
884391	T10	che	brain of noradrenaline (NA), dopamine, 	CANDIDATE	 (5-HT) and 5-hydroxyindoleacetic acid (5-HIAA)
11996963	T21	org	pathologic group. We conclude that 	CANDIDATE	 gestation is associated with an
25315188	T10	ggp	in patients. An expression of 	CANDIDATE	 was further detected in all
180892	T3	che	levels of cyclic AMP and 	CANDIDATE	. DOCEND
22739174	T27	che	of which achieved remission with 	CANDIDATE	 and the others continued to
8834507	T15	che	chickens fed the protein and 	CANDIDATE	 deficiency diet. Vitamin A in
20080129	T10	org	wild-type male mice. In wild-type 	CANDIDATE	, middle-aged females and males show
12756637	T7	org	Dogs infected with Dirofilaria immitis, 	CANDIDATE	, or Borrelia burgdorferi may show
23134572	T46	org	of Vpr function in the 	CANDIDATE	 life cycle. DOCEND
27105912	T7	ggp	leads to impaired Glut4 translocation. 	CANDIDATE	 maintains glucose homeostasis by stimulating
6863180	T3	che	method is described for determining 	CANDIDATE	 in complete feeds, supplements, and
28067668	T15	ggp	overrode Hippo-mediated inhibition and drove 	CANDIDATE	 to the nucleus. Consequent aberrant
29282825	T3	dis	coccidiosis by modulating intestinal microbiota. 	CANDIDATE	 is an intestinal parasitic infection
21729116	T2	ggp	the O-demethylated metabolite, formed via 	CANDIDATE	. This study was designed to
11934385	T6	dis	on a 16-year-old patient with 	CANDIDATE	 who presented a mos 46,X,del(X)(p22.1)[35]/45,X
20200297	T5	org	strains (D106004 and D182038) of 	CANDIDATE	 isolated from Yunnan Province of
24142014	T4	org	higher in people infected with 	CANDIDATE	 than in the general population.
22387228	T34	che	rates of sequential metabolism of 	CANDIDATE	 in cell lysate. The composite
23190557	T42	che	that, in adipose tissue, ER-beta-mediated 	CANDIDATE	 signaling can up-regulate 11betaHSD1 and
19029488	T7	dis	and 28.2% for youth with 	CANDIDATE	. In youth with type 1,
28044452	T3	che	effects of acute, not chronic, 	CANDIDATE	 on LPS-induced hepatic encephalopathy in
21209094	T11	dis	important human diseases such as 	CANDIDATE	, malaria, or trypanosomiasis. Giardia lamblia,
1676299	T13	che	isolated pancreas with 10 microM 	CANDIDATE	, GGT levels decreased from 53
1967259	T4	dis	the heterogeneous clinical manifestations of 	CANDIDATE	 have been associated with specific
20590635	T4	ggp	drug transport. BACKGROUND AND PURPOSE: 	CANDIDATE	 (Pgp) efflux assays are widely
10219637	T5	org	antineutrophil cytoplasmic autoantibodies (ANCA) in 	CANDIDATE	-infected patients. Immunofluorescence tests (IFT)
10657051	T21	che	time that supraphysiological doses of 	CANDIDATE	 could modify the mechano-dynamic properties
16149872	T19	dis	involved in the etiopathogenesis of 	CANDIDATE	, which should lead to novel
8083712	T13	che	in the size of the 	CANDIDATE	-enhancing region or T2-weighted abnormality
11332827	T15	che	dioxide, a sorptive dust, and 	CANDIDATE	 dust, an abrasive, showed synergistic
9718905	T5	che	in the form of either 	CANDIDATE	 or antituberculous drugs along with
6177633	T7	org	that may affect serodiagnosis of 	CANDIDATE	 infections by immunoassays. Antibodies to
3111480	T4	che	binding and oxidative metabolism of 	CANDIDATE	 in human liver microsomes and
25845696	T2	ggp	preoptic area (VLPO) and the 	CANDIDATE	/hypocretin neuronal system are key
27050973	T6	ggp	the coexpression of Notch1 and 	CANDIDATE	 influences the progression and prognosis
29749433	T42	che	and HPAC were examined by 	CANDIDATE	 assay. Treatment with either reparixin
3484439	T18	ggp	murine indicator cells to exogeneous 	CANDIDATE	. Clones were derived directly from
3063793	T20	ggp	confirmed the state of reduced 	CANDIDATE	 sensitivity. Our data demonstrate that
28738804	T20	dis	TINCR, DSCAM-AS1 or HOTAIR inhibited 	CANDIDATE	 cell proliferation, increased apoptosis and
19208558	T17	ggp	Immunoblotting showed the presence of 	CANDIDATE	-cleaved OPN in synovial fluid
17901932	T9	che	for gentamicin but declined for 	CANDIDATE	. The primary investigations revealed that
1212002	T1	dis	An 11-year-old asymptomatic girl with 	CANDIDATE	 was found to have coarctation
28757038	T5	org	mink (Neovison vison). Livestock-associated methicillin-resistant 	CANDIDATE	 (LA-MRSA) clonal complex (CC) 398
29510195	T17	ggp	Mechanistically, UCA1 interacted with MOB1, 	CANDIDATE	, and YAP, forming shielding composites.
25807404	T6	org	[MAP] < 40 mm Hg), the 	CANDIDATE	 received small and equal volumes
21158907	T27	che	was significantly inhibited by melatonin. 	CANDIDATE	 did not reduce NF-kappaB transcriptional
8397980	T8	che	intramolecular hydrogen bond between the 	CANDIDATE	 and the amine N atom
29216203	T9	che	determined the dose-response effects of 	CANDIDATE	 supplementation on arterial stiffness in
24404152	T16	ggp	that the high expression of 	CANDIDATE	 and miR-381 in gliomas are
25791128	T6	dis	fiber was inversely associated with 	CANDIDATE	 (p = 0.03). The positive associations
6166469	T17	org	might be present in normal 	CANDIDATE	 urine. In the present study,
938453	T37	dis	development and function associated with 	CANDIDATE	. DOCEND
29499938	T4	dis	the CRL4BDCAF13 E3 Ligase in 	CANDIDATE	 Cells. Cullins, critical members of
8815183	T14	dis	CD4-matched patients with and without 	CANDIDATE	. CSF abnormalities (in excess of
11120419	T6	dis	known to be impaired in 	CANDIDATE	, which are suggested to be
11258925	T4	ggp	to have two isoforms termed 	CANDIDATE	 and COX-2. This paper reports
10990376	T12	ggp	and 4F2hc (genes SLC3A1 and 	CANDIDATE	, respectively, in the nomenclature of
2950534	T6	org	even more pronounced. Radiosensitivity of 	CANDIDATE	 lymphocytes as determined by means
26201407	T5	org	Effects of anthocyanins from purple 	CANDIDATE	 (Ipomoea batatas L. cultivar Eshu
10971240	T23	che	inter-individual variability than the new 	CANDIDATE	 20 mg tablets on days
7499155	T10	che	change in total and extractable 	CANDIDATE	 (also for 226Ra) content is
1173078	T2	che	DOCSTART Letter: 	CANDIDATE	 and cancer risks. DOCEND
19076431	T7	dis	neurodegenerative diseases, including Alzheimer's disease, 	CANDIDATE	, Huntington's disease, and amyotrophic lateral
12194341	T10	ggp	high for the carbon ion 	CANDIDATE	 if the number of fractions
207923	T6	dis	carcinoma, in one patient an 	CANDIDATE	 was suggested. There were no
13229432	T3	che	reflex. III. Action of 3-otolyloxy-1,2-propanediol (	CANDIDATE	), of eserine, and of DFP
17364023	T29	org	Our results demonstrated that the 	CANDIDATE	 latency-associated nuclear antigen (LANA) bound
9326218	T28	org	The cloning of the complete 	CANDIDATE	 JAK2 coding and genomic sequences
8552616	T7	ggp	exposure to the inflammatory cytokine 	CANDIDATE	 (IL-1 beta). We have reported
29720407	T1	dis	stored dried blood spots for 	CANDIDATE	: a metabolic autopsy of medium-chain
7639472	T6	che	membranes were exposed to different 	CANDIDATE	 concentrations of 10%, 15%, and
15253157	T12	org	recombinant EFE-3 was expressed in 	CANDIDATE	 as inclusion bodies, and the
26804029	T18	che	estimate the total number of 	CANDIDATE	 neurons in the substantia nigra
25966775	T16	che	and des-acyl ghrelin, PYY, leptin, 	CANDIDATE	 levels, total body (TB) and
22056877	T62	dis	In conclusion, CHI3L1 expressed in 	CANDIDATE	 cells promotes cancer cell proliferation,
23273977	T8	dis	A 70-year-old woman presented with 	CANDIDATE	, dysdiadochokinesia, and dysarthria. Her serum
1708092	T12	ggp	of other early genes, including 	CANDIDATE	, c-jun, and junB. The rate
