18611747	T6	dis	with zidovudine in patients with 	CANDIDATE	. Peripheral blood mononuclear cells (PBMCs)
11091077	T1	org	the adult central brain of 	CANDIDATE	. The Drosophila transmembrane protein Linotte
8930703	T2	org	media for enumerating heat-stressed, benzoate-resistant 	CANDIDATE	. A study was undertaken to
18964717	T4	che	is quite good when the 	CANDIDATE	 is oxidized in unbuffered solutions,
23627886	T3	dis	with end ileostomy (EI) for 	CANDIDATE	 (UC). METHOD: Patients undergoing laparoscopic
12586434	T54	che	identifies gray matter lesions involving 	CANDIDATE	 receptors as a major target
9473044	T1	org	initiation of cell division in 	CANDIDATE	: genetic interactions of mutations. sep1+
27623398	T29	ggp	TNF-alpha) and anti-inflammatory cytokines (IL-4, 	CANDIDATE	, TGF-beta) did not differ from
13880426	T6	che	impedance characteristic of a platinized 	CANDIDATE	 electrode. DOCEND
12733598	T19	org	in captive breeding management of 	CANDIDATE	. DOCEND
22196895	T23	ggp	the cytoplasm of lymphoid cells. 	CANDIDATE	 may act in concert with
29912579	T3	dis	one child participant with a 	CANDIDATE	, (2) power wheelchair as an
6339230	T26	che	promote hyperglycemic states. For example, 	CANDIDATE	 is gluconeogenic, catecholamines are glycogenolytic,
28686226	T14	dis	of PCYT1A upregulation, MYC impeded 	CANDIDATE	 cells undergo a mitophagy-dependent necroptosis.
24872582	T56	ggp	demonstrate that in addition to 	CANDIDATE	 activity, the interaction of BKRF3
111713	T3	che	DOCSTART Binding of 	CANDIDATE	 to DNA, RNA and protein
10954424	T27	ggp	canine kidney cells (MDCK), endogenous 	CANDIDATE	 was present in the tight
6276193	T5	che	ED50 of about 10 micrograms/kg. 	CANDIDATE	 inhibition of pancreatic secretion was
23236817	T6	org	into the suspended cells of 	CANDIDATE	 crown galls and co-culture for
27778393	T12	che	introduction of pentafluoroethyl functionalities into 	CANDIDATE	 compounds is of general interest
10720024	T5	che	T, 5alpha dihydrotestosterone (DHT), and 	CANDIDATE	 before, during (days 1, 2,
19653510	T3	che	polyvinyl chloride pipes to suspend 	CANDIDATE	-baited traps. This system offers
21963050	T10	dis	as obese. 363 patients had 	CANDIDATE	 at biopsy; 76 were obese.
23937351	T5	org	not promote osteogenic differentiation in 	CANDIDATE	 bone marrow-derived mesenchymal stem cells
9787177	T39	ggp	to 100%) the activation of 	CANDIDATE	 induced by 0.1 to 0.5
26096460	T18	ggp	pH reduces the activity of 	CANDIDATE	/V6 channels, whereas alkaline pH
7586312	T14	che	the low-dose (125 mg/24 h) 	CANDIDATE	 group. Similar results were obtained
4384589	T21	org	novobiocin, and 12 to methicillin. 	CANDIDATE	, H. parainfluenzae, and H. haemolyticus
24403885	T9	dis	by intra-abdominal pathology such as 	CANDIDATE	.  DOCEND
20877407	T2	che	background for the use of 	CANDIDATE	 during newborn resuscitation and describes
13581876	T2	che	disorders caused by tuberculostatics, especially 	CANDIDATE	]. DOCEND
21466760	T8	dis	cataracts, retinal problems leading to 	CANDIDATE	 and possible blindness. This is
24047565	T4	dis	identify the possible source of 	CANDIDATE	 outbreak, especially when the environmental
12801808	T29	ggp	folate or B12 deficiencies or 	CANDIDATE	 thermolability). Post-methionine-load hyperhomocysteinaemia may be
22030996	T12	che	PARP were hypertension (17.1 %), total 	CANDIDATE	/high density lipoprotein index (16.4
24393995	T10	ggp	3, circ, mod>muc>por>,pSE, ly1, v1, 	CANDIDATE	, sH0, sP0, cM0, fStage IIIb,
21637926	T21	ggp	by immunoblotting and immunohistochemistry. Ectopic 	CANDIDATE	 expression was induced by introducing
11413130	T20	ggp	both wild-type and constitutively active 	CANDIDATE	 phosphorylated LIMK1 even more strongly
3797059	T1	org	oviposition and growth in immature 	CANDIDATE	 after exposure to Schistosoma mansoni.
9413157	T19	che	tumours. Histologically, tumours influenced by 	CANDIDATE	 were better differentiated than control
19723785	T3	che	of D(2)/D(3) receptors following acute 	CANDIDATE	 depletion. OBJECTIVE: Previous positron emission
26416665	T4	che	eleven flavonoids, Artepillin C and 	CANDIDATE	 were analyzed by means of
15980236	T30	ggp	The levels of IFN-gamma and 	CANDIDATE	 were elevated in aqueous humor
27399144	T17	dis	had significantly lower risk of 	CANDIDATE	 and chronic kidney disease. DOCEND
20197421	T38	che	(HIF-1), such as endothelin and 	CANDIDATE	 transporter GLUT1, were not induced.
17993619	T10	org	nucleotides. Here, we report that 	CANDIDATE	 PDCs express several subtypes of
21258966	T1	org	and gastrointestinal effects of immature 	CANDIDATE	 grain (IWG) biscuits. In this
23636489	T4	che	to near-simultaneous imaging of 2-deoxy-2-[(18)F]fluoro-D-glucose (	CANDIDATE	) (brain metabolism) and (11)C-raclopride (D2)
25931981	T11	org	to PMTV is known in 	CANDIDATE	. Control of the vectors of
20673131	T14	ggp	formed throughout the microtissue. Blocking 	CANDIDATE	 matrix polymerization inhibited both cell
2799592	T3	che	effect of halothane, enflurane and 	CANDIDATE	 on the circulation. This study,
62469	T10	che	serum proteins, serum cholesterol, serum 	CANDIDATE	, serum ZST, serum TTT and
15317787	T18	org	T. thermophilus PrmA, like its 	CANDIDATE	 homolog, is dispensable. Ribosomes prepared
29936814	T4	che	level of determined pollutants - especially 	CANDIDATE	, volatile organic compounds (VOCs), including
16311326	T2	che	scale, but a link between 	CANDIDATE	 isotope and sea level on
543893	T14	che	of the strains studied, but 	CANDIDATE	 was more effective against Pseudomonas
25591767	T25	ggp	miR-133b. Also, we observed that 	CANDIDATE	 activated MEK/ERK and PI3K/Akt signaling
20220046	T18	che	context of circadian changes in 	CANDIDATE	-insulin regulation. DOCEND
19275928	T12	org	was orally administered. Water and 	CANDIDATE	 oil (2000 mg/kg) were used
8347485	T5	ggp	to secrete either interleukin 2 (	CANDIDATE	), or interleukin 4 (IL-4), has
12063951	T10	che	a continuous subcutaneous administration of 	CANDIDATE	 (200 micrograms/8 h) and a
21931113	T24	che	Ph(+) ALL, induction treatment with 	CANDIDATE	 plus steroids is associated with
2031529	T10	dis	a lymphoepithelioma. The diagnosis of 	CANDIDATE	 was only excluded with confidence
20446708	T3	che	DOCSTART Nitrogen dioxide-dependent oxidation of 	CANDIDATE	 in the human oral cavity
1761686	T8	org	Actinobacillus actinomycetemcomitans, Fusobacterium nucleatum, and 	CANDIDATE	. Briefly, the procedure involved mixing
8792730	T11	ggp	THRs, but the increase in 	CANDIDATE	 seen after homologous transfusions is
1241620	T8	che	that the detrimental effects of 	CANDIDATE	 may actually be an acetaldehyde
6727349	T39	che	explain the temperature induced biphasic 	CANDIDATE	 dissociation from the receptor. It
26516277	T7	org	of translocator protein TSPO from 	CANDIDATE	 should be used to 1.65
10329188	T2	org	DOCSTART Domain architecture of the 	CANDIDATE	 connector protein. Viral connectors are
14670427	T27	dis	eyes with coexisting aphakia and 	CANDIDATE	 and without vitreous. Intraoperative IOP
23439952	T2	dis	for a patient with severe 	CANDIDATE	 undergoing axillo bifemoral bypass surgery.
26138645	T3	che	Preterm infants often require supplemental 	CANDIDATE	 due to lung immaturity, but
10959423	T4	org	and (b) where the knockout 	CANDIDATE	 does not survive into adulthood,
22521737	T1	che	DOCSTART 	CANDIDATE	 regulates the IL-1 beta induced
13317787	T1	dis	DOCSTART Psychotherapy of 	CANDIDATE	. DOCEND
21255118	T20	che	transduce the energy generated by 	CANDIDATE	 hydrolysis to support secretion. The
17177600	T22	ggp	factor (HB-EGF) and its receptor, 	CANDIDATE	, which form a complex with
22953940	T20	che	significantly, while the level of 	CANDIDATE	 in liver decreased significantly. L.
26490873	T52	dis	of its potential in a 	CANDIDATE	 rat model in vivo. However,
26520687	T21	ggp	higher urinary 8-OHdG, IL-6, IL-1, 	CANDIDATE	 levels and HOMA-IR, and lower
22410201	T4	che	methotrexate, pulses of cyclophosphamide and 	CANDIDATE	, azathioprine, mycophenolate mofetil, adalimumab and
17988961	T20	dis	cell culture medium of Human 	CANDIDATE	 cells treated with varying amounts
19516021	T6	dis	to the increased incidence of 	CANDIDATE	 and other metabolic diseases in
26302683	T10	ggp	possible association between rs895819 within 	CANDIDATE	 and CRC in Han Chinese
20516125	T26	ggp	the lowest tertile of total 	CANDIDATE	 (P trend = 0.01) after adjusting
10100609	T1	ggp	The L2 loop peptide of 	CANDIDATE	 stiffens and restricts base motions
29961649	T12	che	were identified in 66 patients. 	CANDIDATE	 insufficiency (<30 ng/mL) and deficiency
26923771	T4	org	detection of RecA inteins from 	CANDIDATE	. Mechanistic studies demonstrate that InR
24967418	T8	ggp	including vimentin and snail, and 	CANDIDATE	 (Cav-1). However, the induction of
7361706	T14	che	carnitine intake. Sex affects plasma 	CANDIDATE	 levels in Bangkok adults and
15210815	T10	ggp	conditions, but strongly induced by 	CANDIDATE	. We determined the concentration of
25203739	T10	che	or following several years of 	CANDIDATE	 treatment. Nevertheless, this approach is
12635835	T2	dis	strategy for palliative surgery in 	CANDIDATE	 patients remains undetermined. METHODS: In
12878608	T11	org	and characterization of Kv1.3-deficient (Kv1.3-/-) 	CANDIDATE	. In contrast to wild-type cells,
4857280	T1	org	Contribution to the embryology of 	CANDIDATE	 teeth]. DOCEND
24348097	T11	org	and assessed translational relevance in 	CANDIDATE	 studies. Isogenic PTEN-expressing or PTEN-deficient
11512032	T37	che	of DeltaIami to diazoxide, pinacidil, 	CANDIDATE	, or glibenclamide. ENaC does not
16317289	T37	che	the GI50 values of melphalan/	CANDIDATE	 and the anti-mitotic agents. Similarly
22788928	T9	che	10-30 mg TNBS in 50% 	CANDIDATE	 enema weekly for 5 cycles.
12122151	T7	org	smooth muscle cells of the 	CANDIDATE	 portal vein. In the absence
27855242	T1	dis	Biologic or tofacitinib monotherapy for 	CANDIDATE	 in people with traditional disease-modifying
15938672	T4	dis	specific issues relating to pediatric 	CANDIDATE	 are discussed. DOCEND
22238579	T1	org	Identification of immunogenic proteins of 	CANDIDATE	. Evidence is growing for a
6532270	T2	dis	conventional ventilation in patients with 	CANDIDATE	. There is no doubt that
21148045	T8	dis	developed for the treatment of 	CANDIDATE	. The effect of coadministration of
23159356	T3	ggp	to explore the expression of 	CANDIDATE	 in HCC and the correlation
18728246	T22	ggp	II receptors AGTR1 and AGTR2. 	CANDIDATE	 enzymatic activity is required for
20356137	T4	che	modifying its surface chemical composition. 	CANDIDATE	-replica possessing a complementary combination
25392526	T8	org	and mucosal immune responses in 	CANDIDATE	. The chimeric NOD2/TLR2 ligand induced
19957676	T4	che	against oxidative damage induced by 	CANDIDATE	 (H2O2) and its mechanism. METHODS:
28699726	T6	org	Labeo rohita and common carp 	CANDIDATE	 using pH-Stat method. The protein
7448097	T10	che	in P50 of 25% with 	CANDIDATE	 40 kPa compared with control
23619417	T1	org	not cause oxidative damage in 	CANDIDATE	. Life history theory suggests that
27678349	T1	dis	DOCSTART Exploring the 	CANDIDATE	: Nonalcoholic fatty pancreas disease. After
20512578	T58	che	with low ROS to SAHA. 	CANDIDATE	 treatment also sensitized androgen-treated LNCaP
7167463	T14	che	inhibitor of malic enzyme) and 	CANDIDATE	 (an inhibitor of PEP carboxykinase)
27446291	T5	che	DOCSTART Effects of 	CANDIDATE	 on the expression levels of
9244394	T16	org	and recognized human, rat, and 	CANDIDATE	 alpha subunit isoforms at an
11136767	T12	org	Enterobacter sakazakii, n = 1; and 	CANDIDATE	, n = 3) and in two
7519000	T19	che	and Kp (0.43 +/- 0.05 during 	CANDIDATE	 to 0.53 +/- 0.04 mm-1 during
3141300	T10	org	or in combination with recombinant 	CANDIDATE	 IFN-gamma. The surface expression of
22458611	T2	org	and biological activity of potent 	CANDIDATE	 protease inhibitors based on Phe-Pro
16791787	T1	org	classification and the study of 	CANDIDATE	 variation. DOCEND
27318149	T38	che	for bupropion (R and S), 	CANDIDATE	 (R,R and S,S), threohydrobupropion (1S,2S
21794711	T4	dis	average cost per patient with 	CANDIDATE	 treated with chondroitin sulfate compared
10550472	T18	che	not strain pCyN2, also utilized 	CANDIDATE	 and toluene. Both strains grew
1810225	T12	ggp	into cell membrane (s-CRP), ii) 	CANDIDATE	 produced primarily by the liver
28438338	T4	che	influence of environmental concentrations of 	CANDIDATE	 (10, 100, and 1000ng/L) on
20841453	T4	org	domain-containing protein identified in pea (	CANDIDATE	) chloroplasts. It was shown to
19535308	T7	org	cells incubated for 1h with 	CANDIDATE	 or Lactobacillus acidophilus at the
11302691	T5	ggp	prohibitin proteins, Phb1p and Phb2p(	CANDIDATE	), have been ascribed various functions,
26265996	T5	dis	diabetes and recent advances in 	CANDIDATE	 treatments, the reality is that
14564738	T40	che	involved in a bioactivation of 	CANDIDATE	. Lucigenin-dependent chemiluminescence cannot be used
3391610	T2	che	injection of the microencapsulated compound 	CANDIDATE	 and its effect on pituitary-ovarian
6451676	T17	dis	in the understanding of human 	CANDIDATE	 and the pathogenesis of glomerulonephritis.
22571324	T4	dis	are infected. Early diagnosis of 	CANDIDATE	 results in earlier access to
17296734	T4	org	transforming potential of IGF-IR in 	CANDIDATE	 fibroblasts or epithelial cells. We
26286506	T5	org	affected by high rates of 	CANDIDATE	, yet relatively few products exist
21975862	T16	ggp	from obstructed kidneys enhanced the 	CANDIDATE	 production of in vitro-generated Th17
12927598	T1	org	and swelling of mitochondria from 	CANDIDATE	 tissues. The effects of the
18564162	T2	dis	expression profile of Barrett's esophagus. 	CANDIDATE	 (BE) is the metaplastic change
8045862	T10	che	0.05) in the accumulation of 	CANDIDATE	 and ammonia. During recovery, muscle
22172064	T7	che	therapy for Alzheimer's disease. 4-phenylbutyrate (	CANDIDATE	) is a small molecule that
234181	T7	che	antihistaminic medication, with or without 	CANDIDATE	, further decreased the dopamine uptake
20618441	T15	ggp	the affinity of CHIP for 	CANDIDATE	 and Hsp90 using isothermal titration
18619141	T8	che	was observed. The decomposition of 	CANDIDATE	 was found to be first-order
2586759	T7	ggp	combining retrograde tracing methods and 	CANDIDATE	 immunohistochemistry were carried out. No
8556278	T4	dis	children with primary diagnosis of 	CANDIDATE	 (RB) was completed at St.
765382	T1	che	of asthmatic children treated with 	CANDIDATE	. Forty-two perennial asthmatic children were
3478633	T10	che	control animal were negative for 	CANDIDATE	 receptors. It was concluded that
22009939	T17	ggp	determine how the activation of 	CANDIDATE	 by endogenous ligands might affect
18835960	T27	ggp	NCI-H292 and A549 cells. CONCLUSIONS: 	CANDIDATE	 expression is increased in bronchial
6724165	T21	che	h, antibody T204 ) and without 	CANDIDATE	 (428 +/- 62 pmol/l X 3
14740250	T14	org	(Perca flavescens) and rainbow trout (	CANDIDATE	), two species with a more
9652829	T24	dis	to the symptomatic episode of 	CANDIDATE	 in individuals sensitized to the
12456688	T1	ggp	DOCSTART Ubiquitylation of 	CANDIDATE	 inhibits its phosphorylation of MKK1
24372894	T23	che	PEG-IFN/RBV and 45 with PEG-IFN/	CANDIDATE	/telaprevir, and evaluated the impact
26648574	T18	ggp	of 5637 cells in which 	CANDIDATE	 was highly expressed, while the
6855467	T6	org	whole brain GABA metabolism in 	CANDIDATE	 were investigated. A dose-dependent and
24885927	T14	ggp	downstream promotors of fgf10 and 	CANDIDATE	. In addition we show that
19013656	T18	dis	to exploit synthetic dsRNA in 	CANDIDATE	 therapy and to enhance tumor
28601406	T18	dis	proteinuria was also associated with 	CANDIDATE	 risk, showing a dose-response relationship
9171353	T9	ggp	biological function. Thymi lacking functional 	CANDIDATE	 isolated from C3 transgenic mice
28273337	T74	ggp	7, 8, and RAGE mRNA. 	CANDIDATE	, a TLR agonist, was induced
10481117	T23	che	PAF-RA (82 microg/kg WEB-2170), or 	CANDIDATE	 0.9% (volume equivalent). After 18
9815526	T6	dis	in postmenopausal women). Therefore, hormonal 	CANDIDATE	 treatment is often suspect. As
13647801	T1	dis	[Remote results of pneumonectomy in 	CANDIDATE	]. DOCEND
26848703	T27	che	the best combination (40 microM 	CANDIDATE	 and 0.6 microM topotecan), cell
20738903	T1	dis	[Preoperative invasive staging for N2 	CANDIDATE	.]. DOCEND
24141004	T3	dis	patient-administered checklist designed to identify 	CANDIDATE	 patients at elevated risk for
16977574	T18	ggp	cofactor activity (RCo), a sensitive 	CANDIDATE	:collagen-binding activity (CB), ristocetin-induced platelet
4459909	T1	che	DOCSTART [Experiences with 	CANDIDATE	 in microsurgery of the ear
26289137	T8	che	precise mechanism of action of 	CANDIDATE	 is unclear, but has been
23097198	T4	che	and of other SNPs with 	CANDIDATE	 metabolites in urine. METHODS AND
3525560	T17	che	growth, and the addition of 	CANDIDATE	 during the log phase of
25019647	T8	che	suicidal behavior or ideation with 	CANDIDATE	 treatment was 0.37% in pediatric
3501631	T18	org	3' untranslated regions of the 	CANDIDATE	 and mouse genes. In particular,
24433726	T32	ggp	The negative expression rates of 	CANDIDATE	, MSH6 and MGMT in hyperplastic
22609949	T12	org	treatment can accelerate early-onset of 	CANDIDATE	 infection and the proliferative changes
23161397	T3	che	DOCSTART Effect of 	CANDIDATE	 and indomethacin on methotrexate pharmacokinetics
19878036	T15	dis	in preventing joint destruction in 	CANDIDATE	 patients by screening for signs
6374433	T14	che	Excellent metabolic control (= all blood 	CANDIDATE	 concentrations less than 150 mg/dl)
8595600	T35	org	of the intracellular glutathione in 	CANDIDATE	 during the yeast-to-mycelium conversion. DOCEND
8556430	T1	che	indicate the large contribution that 	CANDIDATE	 bonding, electrostatic interactions and, in
22104539	T25	ggp	C-reactive protein correlated significantly with 	CANDIDATE	 (P = 0.002). CONCLUSIONS: Patients with
29540766	T22	ggp	defects or abnormal localisation of 	CANDIDATE	 and NHERF2 in podocytes. Thus,
21564542	T1	org	DOCSTART 	CANDIDATE	 genetic transformation and its application
25919588	T12	org	and to influenza in outbred 	CANDIDATE	, associated with LLPC depletion and
15884845	T9	che	all surface samples (0-0.2 m), 	CANDIDATE	 did not leach at soil
12184785	T26	che	which is known to recognize 	CANDIDATE	 as well as Fapy residues,
10518589	T26	org	required for sustenance. Therefore, DA-/- 	CANDIDATE	 can execute behaviors necessary to
3000368	T1	org	antagonist binding site solubilized from 	CANDIDATE	 platelets. The hydrodynamic properties of
20872711	T23	che	in resistance emergence on either 	CANDIDATE	 or telbivudine as these antivirals
22311682	T15	che	results in unique clinical features. 	CANDIDATE	 is a small molecule inhibitor
21443930	T20	che	and the D2 receptor antagonist 	CANDIDATE	, were co-administered into the dorsal
20228782	T31	ggp	only one STIC showed increased 	CANDIDATE	 immunoreactivity. Carcinomas, when compared with
21732818	T21	org	species are observed. First, in 	CANDIDATE	 there appears to be a
8196089	T22	che	antibiotic concentrations, erythromycin phosphate or 	CANDIDATE	 could be substituted for estolate
27197231	T17	ggp	pathway via direct interaction with 	CANDIDATE	 (cIAP1) and subsequent induction of
16443558	T9	dis	events were infectious complications (36%), 	CANDIDATE	 (27%), and neutropenia (18%); the
26386828	T9	dis	guidelines for Asian population, general 	CANDIDATE	 was defined as body mass
27610244	T18	dis	according to the properties of 	CANDIDATE	.  DOCEND
21884200	T13	ggp	polymorphism of the ER-beta gene (	CANDIDATE	) with colorectal cancer. METHODS AND
12962142	T29	che	baseline values in untreated and 	CANDIDATE	 (p < 0.01 vs. untreated), cariporide
13211995	T22	che	for the enzymatic breakdown of 	CANDIDATE	 at pH 7.65 was found
28606116	T2	che	central synapses is modulated by 	CANDIDATE	 (5-HT). The anterior cingulate cortex
9657073	T4	ggp	forms and distribution of IGFBP-3, 	CANDIDATE	, the acid-labile subunit, and growth
12537767	T8	ggp	cells were positive for HLA-DR, 	CANDIDATE	, CD7, and CD56. A diagnosis
4672285	T3	che	early effects of 7,12-dimethylbenz(a)anthracene and 	CANDIDATE	 on DNA synthesis in rat
12387816	T2	dis	a tripeptide sequence observed in 	CANDIDATE	 patients on the conformation of
28521878	T18	ggp	affect lipids or insulin sensitivity. 	CANDIDATE	 sensitivity was derived from the
908747	T8	che	human jejunum was perfused with 	CANDIDATE	 solutions, the rate of tetraglycine
3496960	T13	org	potent in vitro cytotoxins against 	CANDIDATE	 malignant mesothelioma cells (H-MESO-1) (ID50,
8928821	T38	che	cells. The AA release by 	CANDIDATE	 is partially metabolized by the
2259898	T5	che	immunomodulator OM-8980 with that of 	CANDIDATE	. After 12 months of treatment,
8417276	T13	che	was demonstrated for tolbutamide and 	CANDIDATE	 hydroxylation to 5 psychoactive drugs,
21694869	T11	org	mice. METHODS: Mouse, rat, and 	CANDIDATE	 intact ileal sections were electrically
25888578	T10	ggp	basis of the expression of 	CANDIDATE	, CD11c, F4/80, Ly6C, Ly6G, and
20534839	T12	org	from the forebrain/hippocampus of EE-reared 	CANDIDATE	 during the first two postnatal
21784621	T1	che	DOCSTART 	CANDIDATE	 augmentation strategy in clomipramine-resistant depressive
29740693	T4	dis	AvED among all patients, including 	CANDIDATE	 patients after curation, and the
7510095	T2	dis	of bone remodeling. Osteoporosis and 	CANDIDATE	 both represent examples of abnormal
8987681	T9	org	copolymer. A culture supernatant of 	CANDIDATE	 containing extracellular beta-mannanase and alpha-galactosidase
17881773	T4	org	characterized the peroxisomal compartment in 	CANDIDATE	 and mouse testis in primary
5357991	T4	che	DOCSTART [The relationship between blood 	CANDIDATE	 levels and the effect of
10868007	T5	dis	acute, subacute or late stent 	CANDIDATE	. CONCLUSION: Our first experience with
9467236	T25	che	These negative side effects of 	CANDIDATE	 treatment should be avoided and
9134761	T20	che	consequences were observed. Adaptation to 	CANDIDATE	 was demonstrated by increased catalase
3311503	T12	che	(predicted 3083 +/- 201 ml). Elevated 	CANDIDATE	 levels were seen in CAPD
12755300	T6	che	anesthesia was maintained with inspired 	CANDIDATE	 for 2.25 hours. Blood gases
24241416	T7	org	from immature embryos of four 	CANDIDATE	 (Triticum aestivum L.) and one
17411482	T7	che	The susceptibility of representative pyrethroid (	CANDIDATE	, deltamethrin, lambdacyhalothrin, bifenthrin), organophosphate (chlorpyriphos,
6824815	T7	che	histamine, bradykinin and acetylcholine. 1 	CANDIDATE	 (NA) evoked a vasoconstrictor response
11502823	T3	che	2 diabetes. GLP-1 lowers blood 	CANDIDATE	 in fasting type 2 diabetic
20432044	T7	org	isolated bacteria included Staphylococcus aureus, 	CANDIDATE	, Escherichia coli, Proteus mirabilis, and
20338785	T6	org	bronchitis virus, Newcastle disease virus, 	CANDIDATE	, influenza A virus, Marek's disease
10534567	T17	che	targets for Hsp70-mediated protection against 	CANDIDATE	 depletion. We also consider how
24051059	T28	org	the LPS-induced inflammatory response in 	CANDIDATE	 fetal membranes.  DOCEND
10398070	T14	ggp	hypothesis that Schwann cells produce 	CANDIDATE	 which lacks inserts at the
11960268	T7	dis	activity. Untreated patients develop progressive 	CANDIDATE	 and multisystem morbidity with a
27061807	T24	ggp	MGO modification decreased susceptibility of 	CANDIDATE	 to trypsinolysis and prevented its
6704181	T8	che	(AcThCh) in the presence of 	CANDIDATE	 0.1 mM. At 1 1/2
8724352	T12	ggp	Three of the antisera neutralized 	CANDIDATE	-induced interpubic ligament formation in
19294197	T2	org	Cultures of Corn, Tomato, and 	CANDIDATE	. Population dynamics, rate of root
8251777	T7	dis	neoplasms by type of first 	CANDIDATE	, age at first diagnosis, calendar
164472	T27	che	transport of uridine, thymidine or 	CANDIDATE	, although the transport capacity of
3286629	T1	che	reductase in the biosynthesis of 	CANDIDATE	. The 6-lactoyl tetrahydropterin (C1'-keto PH4)
8334202	T17	che	following a maintenance therapy with 	CANDIDATE	 (200 mg/d), we had two
25963684	T3	dis	national cancer registry]. The national 	CANDIDATE	 registry in Japan will commence
20236100	T12	che	of 46-54. Ephedrine, atropine and 	CANDIDATE	 were used to maintain hemodynamic
23259774	T18	dis	of OCs in women with 	CANDIDATE	. DOCEND
19564171	T16	che	patients had received an anthracycline, 	CANDIDATE	 and a taxane. Ten patients
10492377	T23	dis	the athymic mice bearing human 	CANDIDATE	 xenografts. RESULTS: The association constant
29781625	T1	che	DOCSTART Vertically Emitting 	CANDIDATE	 Nanowire Lasers. Semiconductor nanowire (NW)
2994918	T5	che	in blood pressure was observed. 	CANDIDATE	 was shown to be as
16721787	T1	dis	Arg72Pro polymorphism and risk of 	CANDIDATE	 and cancer. A single nucleotide
1638994	T9	ggp	germarium and is dependent on 	CANDIDATE	 and egalitarian. While in stage
16001267	T4	org	in postnatal (P0-P36) and adult 	CANDIDATE	 (P60-90). CRF-immunoreactivity (IR) was present
19006194	T21	dis	in the development of translocation-negative 	CANDIDATE	. DOCEND
1185742	T1	dis	Inflammatory involvement of vertebrae in 	CANDIDATE	. Unusual destructive lesions of the
16237446	T12	ggp	Arabidopsis a second protein kinase, 	CANDIDATE	, is required for the quantitative
27323105	T2	dis	between TBX20 gene polymorphism and 	CANDIDATE	. Congenital heart disease in children
27790006	T10	che	suitably low target of plasma 	CANDIDATE	, a progressive increase in therapy
10750600	T10	dis	779 person-years), 982 cases of 	CANDIDATE	 occurred and were confirmed by
20592809	T13	ggp	our recent paper on the 	CANDIDATE	 mediating cytokinin signaling to regulate
22032847	T8	dis	with 1 to 2 small 	CANDIDATE	 without advanced features have a
18059653	T2	org	those of trainers with >12 	CANDIDATE	. Irrespective of management system, it
